StockCode,Description,SETS,Colors,Material,Design,Jewelry,Household,MISC
35915C,PEACH KNITTED HEN ,0,0,0,0,0,0,1
35916A,YELLOW FELT HANGING HEART W FLOWER,0,1,0,1,0,0,0
35916B,BLUE FELT HANGING HEART W FLOWER,0,1,0,1,0,0,0
35916B,BLUE FELT HANGING HEART WITH FLOWER,0,1,0,1,0,0,0
35916C,PINK FELT HANGING HEART W FLOWER,0,1,0,1,0,0,0
35920,FOUR RABBIT EASTER DECORATIONS,0,0,0,0,0,0,1
35921,EASTER BUNNY HANGING GARLAND,0,0,0,0,0,0,1
35922,EASTER BUNNY WREATH,0,0,0,0,0,0,1
35923,CANDY HEART HANGING DECORATION,0,0,0,1,0,0,0
35924,HANGING FAIRY CAKE DECORATION,0,0,0,1,0,0,0
35933,PINK STOCKING CHRISTMAS DECORATION,0,1,0,1,0,0,0
35953,FOLKART STAR CHRISTMAS DECORATIONS,0,0,0,1,0,0,0
35954,SMALL FOLKART STAR CHRISTMAS DEC,0,0,0,1,0,0,0
35957,SMALLFOLKART BAUBLE CHRISTMAS DEC,0,0,0,1,0,0,0
35958,FOLKART ZINC STAR CHRISTMAS DEC,0,0,0,1,0,0,0
35961,FOLKART ZINC HEART CHRISTMAS DEC,0,0,0,1,0,0,0
35964,FOLKART CLIP ON STARS,0,0,0,1,0,0,0
35965,FOLKART HEART NAPKIN RINGS,0,0,0,1,1,0,0
35966,FOLKART CHRISTMAS TREE T-LIGHT HOLD,0,0,0,1,0,0,0
35967,FOLK ART METAL STAR T-LIGHT HOLDER,0,0,1,1,0,0,0
35968,FOLK ART METAL HEART T-LIGHT HOLDER,0,0,1,1,0,0,0
35970,ZINC FOLKART SLEIGH BELLS,0,0,0,0,0,0,1
35971,ROSE FOLKART HEART DECORATIONS,0,0,0,1,0,0,0
35972,DAISY FOLKART HEART DECORATION,0,0,0,1,0,0,0
37327,ASSTD MULTICOLOUR CIRCLES MUG,0,0,0,0,0,1,0
37330,BIG POLKADOT MUG,0,0,0,1,0,1,0
37333,"RETRO ""TEA FOR ONE"" ",0,0,0,0,0,0,1
37340,MULTICOLOUR SPRING FLOWER MUG,0,0,0,1,1,1,0
37342,POLKADOT COFFEE CUP & SAUCER PINK,0,1,0,1,0,1,0
37343,POLKADOT MUG PINK ,0,1,0,1,0,1,0
37351,ORANGE FLOWER MUG ,0,1,0,1,0,1,0
37370,RETRO COFFEE MUGS ASSORTED,1,0,0,0,0,1,0
37379A,PINK CHERRY BLOSSOM CUP & SAUCER,0,1,0,1,0,1,0
37413,ICON MUG REVOLUTIONARY,0,0,0,0,0,1,0
37423,WHITE WITH BLACK CATS PLATE,0,1,0,1,0,1,0
37444A,YELLOW BREAKFAST CUP AND SAUCER,0,1,0,0,0,1,0
37444B,BLUE BREAKFAST CUP AND SAUCER ,0,1,0,0,0,1,0
37444C,PINK BREAKFAST CUP AND SAUCER ,0,1,0,0,0,1,0
37446,MINI CAKE STAND WITH HANGING CAKES,0,0,0,0,0,0,1
37447,CERAMIC CAKE DESIGN SPOTTED PLATE,0,0,0,1,0,1,0
37448,CERAMIC CAKE DESIGN SPOTTED MUG,0,0,0,1,0,1,0
37449,CERAMIC CAKE STAND + HANGING CAKES,0,0,0,0,0,0,1
37450,CERAMIC CAKE BOWL + HANGING CAKES,0,0,0,0,0,0,1
37461,FUNKY MONKEY MUG,0,0,0,0,0,1,0
37462E,"PET MUG, GOLDFISH",0,0,0,0,0,1,0
37464,ROBOT MUG IN DISPLAY BOX,1,0,0,0,0,1,0
37467,PIG MUG IN TWO COLOUR DESIGNS,0,0,0,1,0,1,0
37468,HARDMAN MUG 3 ASSORTED,1,0,0,0,0,1,0
37471,MULTICOLOUR POLKADOT PLATE,0,0,0,1,0,1,0
37474,SET/4 2 TONE EGG SHAPE MIXING BOWLS,1,0,0,0,0,0,0
37475,SET/4 COLOURFUL MIXING BOWLS,1,0,0,0,0,0,0
37476,CONDIMENT TRAY 4 BOWLS AND 4 SPOONS,0,0,0,0,0,1,0
37479B,CUBIC MUG FLOCK BLUE ON BROWN,0,1,0,0,0,1,0
37479P,CUBIC MUG FLOCK PINK ON BROWN,0,1,0,0,0,1,0
37482P,CUBIC MUG PINK POLKADOT,0,1,0,1,0,1,0
37487B,YELLOW/ORANGE FLOWER DESIGN PLATE,0,1,0,1,0,1,0
37488A,YELLOW PINK FLOWER DESIGN BIG BOWL,0,1,0,1,0,0,0
37489A,YELLOW/PINK FLOWER DESIGN BIG MUG,0,1,0,1,0,1,0
37489B,BLUE/YELLOW FLOWER DESIGN BIG MUG,0,1,0,1,0,1,0
37489C,GREEN/BLUE FLOWER DESIGN BIG MUG,0,1,0,1,0,1,0
37489D,PINK/GREEN FLOWER DESIGN BIG MUG,0,1,0,1,0,1,0
37491A,YELLOW/PINK CERAMIC CANDLE HOLDER,0,1,0,0,0,1,0
37491B,BLUE/YELLOW CERAMIC CANDLE HOLDER,0,1,0,0,0,1,0
37491C,GREEN/BLUE CERAMIC CANDLE HOLDER,0,1,0,0,0,1,0
37491D,PURPLE/BLUE CERAMIC CANDLE HOLDER,0,1,0,0,0,1,0
37495,FAIRY CAKE BIRTHDAY CANDLE SET,1,0,0,1,0,1,0
37500,TEA TIME TEAPOT IN GIFT BOX,1,0,0,0,0,1,0
37501,TEA TIME TEA SET IN GIFT BOX,1,0,0,0,0,1,0
37503,TEA TIME CAKE STAND IN GIFT BOX,1,0,0,0,0,1,0
37509,NEW ENGLAND MUG W GIFT BOX,1,0,0,0,0,1,0
40001,WHITE BAMBOO RIBS LAMPSHADE,0,1,0,0,0,0,0
40005B,BLUE ORGANDY ROUND LAMPSHADE W BEA,0,1,0,0,0,0,0
40016,CHINESE DRAGON PAPER LANTERNS,0,0,1,0,0,0,0
40046A,RED DAISY PAPER LAMPSHADE,0,1,1,1,0,0,0
44089A,PINK GAUZE BUTTERFLY LAMPSHADE,0,1,0,1,0,0,0
44089C,LILAC GAUZE BUTTERFLY LAMPSHADE,0,0,0,1,0,0,0
44091A,BLUE CRUSOE CHECK LAMPSHADE,0,1,0,0,0,0,0
44092B,BLUE WHITE PLASTIC RINGS LAMPSHADE,0,1,0,0,1,0,0
44092C,PURPLE/COPPER HANGING LAMPSHADE,0,1,0,0,0,0,0
44228,CANNABIS LEAF BEAD CURTAIN,0,0,0,0,0,0,1
44234,ASSORTED CIRCULAR MOBILE,1,0,0,0,0,0,0
44235,ASS COL CIRCLE MOBILE ,0,0,0,0,0,0,1
44235,ASSORTED COLOURED CIRCLE MOBILE ,1,1,0,0,0,0,0
44236,PINK/PURPLE CIRCLE CURTAIN,0,1,0,0,0,0,0
44242A,LILAC FEATHERS CURTAIN,0,0,0,0,0,0,1
44242B,PINK FEATHERS CURTAIN,0,1,0,0,0,0,0
44265,M/COLOUR POM-POM CURTAIN,0,0,0,0,0,0,1
45013,FOLDING SHOE TIDY,0,0,0,0,0,0,1
46115B,GREEN POP ART MAO CUSHION COVER ,0,1,0,0,0,1,0
46118,FUNKY MONKEY CUSHION COVER,0,0,0,0,0,1,0
46126A,ELVIS WALLHANGING / CURTAIN,0,0,0,0,0,0,1
46138B,BLUE CHENILLE SHAGGY CUSHION COVER ,0,1,0,0,0,1,0
46775D,SUNSET COLOUR CHUNKY KNITTED THROW,1,0,0,0,0,0,0
46776A,WOVEN BUBBLE GUM CUSHION COVER,0,0,0,0,0,1,0
46776B,WOVEN BERRIES CUSHION COVER ,0,0,0,0,0,1,0
46776C,WOVEN FROST CUSHION COVER,0,0,0,0,0,1,0
46776D,WOVEN SUNSET CUSHION COVER ,1,0,0,0,0,1,0
46776E,WOVEN CANDY CUSHION COVER ,0,0,0,0,0,1,0
46776F,WOVEN ROSE GARDEN CUSHION COVER ,0,0,0,0,0,1,0
47013A,WINE BOTTLE DRESSING LT.BLUE,0,1,0,0,0,1,0
47013C,WINE BOTTLE DRESSING DARK BLUE,0,1,0,0,0,1,0
47016,LIGHT DECORATION BATTERY OPERATED,0,0,0,0,0,0,1
47021G,SET/6 BEAD COASTERS GAUZE BAG GOLD,1,0,0,0,0,0,0
47310M,SMALL POP BOX FUNKY MONKEY,1,0,0,0,0,0,0
47310M,"SMALL POP BOX,FUNKY MONKEY",1,0,0,0,0,0,0
47341A,FUSCHIA TABLE RUN FLOWER ,0,0,0,1,0,1,0
47341B,BLUE TABLE RUN FLOWER,0,1,0,1,0,1,0
47343A,FUSCHIA FLOWER PURSE WITH BEADS,0,0,0,1,0,0,0
47344B,BLUE FLOWER DES PURSE,0,1,0,1,0,0,0
47348A,FUSCHIA VOILE POINTY SHOE DEC,0,0,0,0,0,0,1
47351B,BLUE  VOILE LAMPSHADE,0,1,0,0,0,0,0
47367B,PAIR PADDED HANGERS PINK CHECK,0,1,0,0,0,1,0
47369A,PINK GREEN EMBROIDERY COSMETIC BAG,0,1,0,0,0,0,0
47369B,BLUE GREEN EMBROIDERY COSMETIC BAG,0,1,0,0,0,0,0
47420,ASSORTED COLOUR SUCTION CUP HOOK,1,0,0,0,0,1,0
47421,ASSORTED COLOUR LIZARD SUCTION HOOK,1,0,0,0,0,0,0
47422,ASSORTED MONKEY SUCTION CUP HOOK,1,0,0,0,0,1,0
47469,ASSORTED SHAPES PHOTO CLIP SILVER ,1,0,0,0,0,0,0
47471,RAINBOW PEGS PHOTO CLIP STRING,0,0,0,0,1,0,0
47480,HANGING PHOTO CLIP ROPE LADDER,0,0,0,0,0,0,1
47481,50CM METAL STRING WITH  7 CLIPS,0,0,1,0,1,0,0
47503A,ASS FLORAL PRINT MULTI SCREWDRIVER,0,0,0,0,0,0,1
47503H,ASS FLORAL PRINT SPIRIT LEVEL ,0,0,0,0,0,0,1
47503J,SET/3 FLORAL GARDEN TOOLS IN BAG,1,0,0,0,0,1,0
47504H,ENGLISH ROSE SPIRIT LEVEL ,0,0,0,0,0,0,1
47504K,ENGLISH ROSE GARDEN SECATEURS,0,0,0,1,0,1,0
47518f,ICON PLACEMAT POP ART ELVIS,0,0,0,0,0,0,1
47556B,TEA TIME TEA TOWELS ,0,0,0,0,0,0,1
47559B,TEA TIME OVEN GLOVE,0,0,0,0,0,0,1
47563A,RETRO LONGBOARD IRONING BOARD COVER,0,0,0,0,0,0,1
47566,PARTY BUNTING,0,0,0,0,0,0,1
47566B,TEA TIME PARTY BUNTING,0,0,0,0,0,0,1
47567B,TEA TIME KITCHEN APRON,0,0,0,0,0,1,0
47570B,TEA TIME TABLE CLOTH,0,0,0,0,0,1,0
47574A,ENGLISH ROSE SCENTED HANGING FLOWER,0,0,0,1,0,0,0
47574B,ENGLISH ROSE SCENTED HANGING HEART,0,0,0,1,0,0,0
47578A,ENGLISH ROSE SMALL SCENTED FLOWER,0,0,0,1,0,0,0
47579,TEA TIME BREAKFAST BASKET,0,0,0,0,0,0,1
47580,TEA TIME DES TEA COSY,0,0,0,0,0,0,1
47586A,PINK FAIRY CAKE CUSHION COVER,0,1,0,1,0,1,0
47589,CONGRATULATIONS BUNTING,0,0,0,0,0,0,1
47590A,BLUE HAPPY BIRTHDAY BUNTING,0,1,0,1,0,0,0
47590B,PINK HAPPY BIRTHDAY BUNTING,0,1,0,1,0,0,0
47591B,SCOTTIES CHILDRENS APRON,0,0,0,0,0,0,1
47591D,PINK FAIRY CAKE CHILDRENS APRON,0,1,0,1,0,0,0
47593A,CAROUSEL PONIES BABY BIB,0,0,0,0,0,0,1
47593B,SCOTTIE DOGS BABY BIB,0,0,0,1,0,0,0
47594A,CAROUSEL DESIGN WASHBAG,0,0,0,1,0,0,0
47594B,SCOTTIES DESIGN WASHBAG,0,0,0,1,0,0,0
47599A,PINK PARTY BAGS,0,1,0,0,0,0,0
47599B,BLUE PARTY BAGS ,0,1,0,0,0,0,0
48111,DOORMAT 3 SMILEY CATS,0,0,0,1,0,1,0
48116,DOORMAT MULTICOLOUR STRIPE,0,0,0,0,0,1,0
48129,DOORMAT TOPIARY,0,0,0,0,0,1,0
48138,DOORMAT UNION FLAG,0,0,0,1,0,1,0
48173C,DOORMAT BLACK FLOCK ,0,1,0,0,0,1,0
48184,DOORMAT ENGLISH ROSE ,0,0,0,0,0,1,0
48185,DOORMAT FAIRY CAKE,0,0,0,1,0,1,0
48187,DOORMAT NEW ENGLAND,0,0,0,0,0,1,0
48188,DOORMAT WELCOME PUPPIES,0,0,0,0,0,1,0
48189,DOORMAT FRIENDSHIP ,0,0,0,0,0,1,0
48194,DOORMAT HEARTS,0,0,0,1,0,1,0
51008,AFGHAN SLIPPER SOCK PAIR,0,0,0,0,0,0,1
51014A,"FEATHER PEN,HOT PINK",0,1,0,0,0,0,0
51014C,"FEATHER PEN,COAL BLACK",0,1,0,0,0,0,0
51014L,"FEATHER PEN,LIGHT PINK",0,1,0,0,0,0,0
51020A,SUMMER FUN DESIGN SHOWER CAP,0,0,0,1,0,0,0
51020B,STRIPY DESIGN SHOWER CAP,0,0,0,1,0,0,0
62018,SOMBRERO ,0,0,0,0,0,0,1
62043B,BLUE CHECK BAG W HANDLE 34X20CM,0,1,0,0,0,0,0
62074B,ELEPHANT CLIP W SUCTION CUP,0,0,0,0,0,1,0
62086A,PINK RETRO BIG FLOWER BAG,0,1,0,1,0,0,0
62094B,TURQ ICE CREAM BUM BAG ,0,0,0,0,0,0,1
62096A,PINK/YELLOW FLOWERS HANDBAG,0,1,0,1,0,0,0
62096B,PURPLE/TURQ FLOWERS HANDBAG,0,1,0,1,0,0,0
62097B,BLUE STRIPES SHOULDER BAG,0,1,0,0,0,0,0
70006,LOVE HEART POCKET WARMER,0,0,0,1,0,0,0
70007,HI TEC ALPINE HAND WARMER,0,0,0,0,0,0,1
71038,WHITE HANGING BEADS CANDLE HOLDER,0,1,0,0,0,1,0
71050,SMALL SINGLE FLAME CANDLE HOLDER,0,0,0,0,0,1,0
71053,WHITE METAL LANTERN,0,1,1,0,0,0,0
71053,WHITE MOROCCAN METAL LANTERN,0,1,1,0,0,0,0
71101E,STANDING FAIRY POLE SUPPORT ,0,0,0,1,0,0,0
71143,ANTIQUE SILVER BOOK MARK WITH BEADS,0,0,0,1,0,0,0
71143,SILVER BOOK MARK WITH BEADS,0,0,0,0,0,0,1
71215,METAL BASE FOR CANDLES,0,0,1,0,0,1,0
71270,PHOTO CLIP LINE,0,0,0,0,0,0,1
71279,PINK GLASS CANDLEHOLDER,0,1,1,0,0,1,0
71403,"PINK/WHITE ""KEEP CLEAN"" BULLET BIN",0,1,0,0,0,0,0
71406C,BLACK ORANGE SQUEEZER,0,1,0,0,0,0,0
71459,HANGING JAM JAR T-LIGHT HOLDER,0,0,0,0,0,1,0
71459,HANGING JAM JAR T-LIGHT HOLDERS,0,0,0,0,0,1,0
71477,COLOUR GLASS. STAR T-LIGHT HOLDER,0,0,1,1,0,0,0
71477,COLOURED GLASS STAR T-LIGHT HOLDER,0,1,1,1,0,0,0
71495A,CD WALL TIDY BLUE OFFICE,0,1,0,0,0,0,0
71495B,CD WALL TIDY RED FLOWERS,0,1,0,1,0,0,0
71496A,A4 WALL TIDY BLUE OFFICE,0,1,0,0,0,0,0
71496B,A4 WALL TIDY RED FLOWERS,0,1,0,1,0,0,0
71510,SQUARE METAL CANDLEHOLDER BASE,0,0,1,0,0,1,0
72024U,LILAC VOTIVE CANDLE,0,0,0,0,0,1,0
72051S,BAG OF SILVER STONES,0,0,0,0,0,0,1
72122,COFFEE SCENT PILLAR CANDLE,0,0,0,0,0,1,0
72127,COLUMBIAN CANDLE ROUND ,0,0,0,0,0,1,0
72130,COLUMBIAN CANDLE ROUND,0,0,0,0,0,1,0
72132,COLUMBIAN CUBE CANDLE,0,0,0,0,0,1,0
72133,COLUMBIAN CANDLE RECTANGLE,0,0,0,0,0,1,0
72134,COLUMBIAN  CUBE CANDLE ,0,0,0,0,0,1,0
72140E,BEST DAD CANDLE LETTERS,0,0,0,0,0,1,0
72225C,LAVENDER SCENT CAKE CANDLE,0,0,0,0,0,1,0
72232,FENG SHUI PILLAR CANDLE,0,0,0,0,0,1,0
72349b,SET/6 PURPLE BUTTERFLY T-LIGHTS,1,1,0,1,0,0,0
72351A,SET/6 TURQUOISE BUTTERFLY T-LIGHTS,1,0,0,1,0,0,0
72351B,SET/6 PINK  BUTTERFLY T-LIGHTS,1,1,0,1,0,0,0
72369A,PINK CLEAR GLASS CANDLE PLATE,0,1,1,0,0,1,0
72586,SET OF 6 HALLOWEEN GHOST T-LIGHTS,1,0,0,1,0,0,0
72598,SET/12 TAPER CANDLES,1,0,0,0,0,1,0
72709,IVORY SCULPTED RND CANDLE ,0,0,0,0,0,1,0
72741,GRAND CHOCOLATECANDLE,0,0,0,0,0,1,0
72760B,VINTAGE CREAM 3 BASKET CAKE STAND,0,0,0,1,0,0,0
72780,BLACK SILOUETTE CANDLE PLATE,0,1,0,0,0,1,0
72783,BLACK SIL'T SQU CANDLE PLATE ,0,1,0,0,0,1,0
72798C,SET/4 GARDEN ROSE DINNER CANDLE,1,0,0,0,0,1,0
72799C,PINK PILLAR CANDLE SILVER FLOCK,0,1,0,0,0,1,0
72799E,IVORY PILLAR CANDLE SILVER FLOCK,0,0,0,0,0,1,0
72799F,IVORY PILLAR CANDLE GOLD FLOCK,0,0,0,0,0,1,0
72800B, 4 PURPLE FLOCK DINNER CANDLES,0,1,0,0,0,1,0
72800C,4 PINK DINNER CANDLE SILVER FLOCK,0,1,0,0,0,1,0
72800D,4 BLUE DINNER CANDLES SILVER FLOCK,0,1,0,0,0,1,0
72800E,4 IVORY DINNER CANDLES SILVER FLOCK,0,0,0,0,0,1,0
72801C,4 ROSE PINK DINNER CANDLES,0,1,0,0,0,1,0
72801D,4 SKY BLUE DINNER CANDLES,0,1,0,0,0,1,0
72801G,4 BURGUNDY WINE DINNER CANDLES,0,0,0,0,0,1,0
72802A,ROSE SCENT CANDLE IN JEWELLED BOX,1,0,0,0,0,1,0
72802B,OCEAN SCENT CANDLE IN JEWELLED BOX,1,0,0,0,0,1,0
72802C,VANILLA SCENT CANDLE JEWELLED BOX,1,0,0,0,0,1,0
72803A,ROSE SCENT CANDLE JEWELLED DRAWER,0,0,0,0,0,1,0
72803b,OCEAN SCENT CANDLE JEWELLED DRAWER,0,0,0,0,0,1,0
72807A,SET/3 ROSE CANDLE IN JEWELLED BOX,1,0,0,0,0,1,0
72807B,SET/3 OCEAN SCENT CANDLE JEWEL BOX,1,0,0,0,0,1,0
72807C,SET/3 VANILLA SCENTED CANDLE IN BOX,1,0,0,0,0,1,0
72811,SMALL ZINC/GLASS CANDLEHOLDER,0,0,1,0,0,1,0
72812,LARGE ZINC GLASS CANDLEHOLDER,0,0,1,0,0,1,0
72815,3 WICK CHRISTMAS BRIAR CANDLE ,0,0,0,1,0,1,0
72816,SET/3 CHRISTMAS DECOUPAGE CANDLES,1,0,0,1,0,1,0
72817,SET OF 2 CHRISTMAS DECOUPAGE CANDLE,1,0,0,1,0,1,0
72818,CHRISTMAS DECOUPAGE CANDLE,0,0,0,1,0,1,0
72819,CUPID DESIGN SCENTED CANDLES,0,0,0,1,0,1,0
72821,CUPID SCENTED CANDLE IN GLASS,0,0,1,0,0,1,0
75011,BLUE DAISY MOBILE,0,1,0,1,0,0,0
75013B,"STRING OF 8 BUTTERFLIES,PINK",0,1,0,1,1,0,0
75049L,LARGE CIRCULAR MIRROR MOBILE,0,0,0,0,0,0,1
75131,METAL TUBE CHIME ON BAMBOO,0,0,1,0,0,0,0
75172,PAINTED SEA SHELL METAL WINDCHIME,0,0,1,0,0,0,0
75178,ASSTD COL BUTTERFLY/CRYSTAL W/CHIME,0,0,1,1,0,0,0
77079,DOLPHIN WINDMILL,0,0,0,0,0,0,1
77101A,UNION FLAG WINDSOCK,0,0,0,1,0,0,0
78033,FLAG OF ST GEORGE CHAIR,0,0,0,1,0,0,0
78034B,BLUE NETTING STORAGE HANGER,0,1,0,0,0,1,0
78124,MAGAZINE RACK GEBRA ASSORTED ,1,0,0,0,0,0,0
79000,MOROCCAN TEA GLASS,0,0,1,0,0,0,0
79026B,"S/4 ICON COASTER,ELVIS LIVES",0,0,0,0,0,0,1
79030D,TUMBLER BAROQUE,0,0,0,0,0,0,1
79030D,"TUMBLER, BAROQUE",0,0,0,0,0,0,1
79030G,TUMBLER NEW ENGLAND,0,0,0,0,0,0,1
79030G,"TUMBLER, NEW ENGLAND",0,0,0,0,0,0,1
79051A,SMOKEY GREY COLOUR D.O.F. GLASS,0,1,1,0,0,0,0
79051A,SMOKEY GREY COLOUR GLASS,0,1,1,0,0,0,0
79062D,"RETRO TIN ASHTRAY,REVOLUTIONARY",0,0,0,0,0,0,1
79063C,"RETRO PILL BOX KEY CHAIN,THE KING",1,0,0,0,0,0,0
79063D,"RETRO PILL BOX , REVOLUTIONARY",1,0,0,0,0,0,0
79066K,RETRO MOD TRAY,0,0,0,0,0,0,1
79067,CORONA MEXICAN TRAY,0,0,0,0,0,0,1
79071B,ENGLISH ROSE METAL WASTE BIN,0,0,1,0,0,0,0
79144B,PAINTED LIGHTBULB STAR+ MOON,0,0,0,1,0,0,0
79144C,PAINTED LIGHTBULB RAINBOW DESIGN,0,0,0,1,0,0,0
79149B,SILICON STAR BULB  BLUE,0,1,0,1,0,0,0
79151B,"SILICON CUBE 25W, BLUE",0,1,0,0,0,0,0
79157B,UBO-LIGHT TRIOBASE BLUE,0,1,0,0,0,0,0
79157V,UBO-LIGHT TRIOBASE PURPLE,0,1,0,0,0,0,0
79160,HEART SHAPE WIRELESS DOORBELL,0,0,0,1,0,0,0
79161A,ST GEORGE SET OF 10 PARTY LIGHTS,1,0,0,0,0,0,0
79163,BLACK CHAMPAGNE GLASS,0,1,1,0,0,0,0
79164,BLACK WINE GLASS,0,1,1,0,0,0,0
79190A,RETRO PLASTIC 70'S TRAY,0,0,0,0,0,0,1
79190D,RETRO PLASTIC DAISY TRAY,0,0,0,1,0,0,0
79191B,RETRO PLASTIC POLKA TRAY,0,0,0,0,0,0,1
79191C,RETRO PLASTIC ELEPHANT TRAY,0,0,0,0,0,0,1
79302M,"ART LIGHTS,FUNK MONKEY",0,0,0,0,0,0,1
79320,FLAMINGO LIGHTS,0,0,0,0,0,0,1
79321,CHILLI LIGHTS,0,0,0,0,0,0,1
79323B,BLACK CHERRY LIGHTS,0,1,0,1,0,0,0
79323P,PINK CHERRY LIGHTS,0,1,0,1,0,0,0
79323W,WHITE CHERRY LIGHTS,0,1,0,1,0,0,0
79329,PINK FLOCK GLASS CANDLEHOLDER,0,1,1,0,0,1,0
79336,LIGHT PINK FLOCK GLASS CANDLEHOLDER,0,1,1,0,0,1,0
79337,BLUE FLOCK GLASS CANDLEHOLDER,0,1,1,0,0,1,0
79403,FROSTED WHITE BASE ,0,1,0,0,0,0,0
81950B,FLOWER BLUE CLOCK WITH SUCKER,0,1,0,1,0,1,0
81950V,FLOWER PURPLE CLOCK W/SUCKER,0,1,0,1,0,1,0
81950V,FLOWER PURPLE CLOCK WITH SUCKER,0,1,0,1,0,1,0
81952B,ROUND BLUE CLOCK WITH SUCKER,0,1,0,0,0,1,0
81952V,ROUND PURPLE CLOCK WITH SUCKER,0,1,0,0,0,1,0
81953P,ROUND ARTICULATED PINK CLOCK W/SUCK,0,1,0,0,0,1,0
82001S,SILVER RECORD COVER FRAME,0,0,0,0,0,0,1
82001S,VINYL RECORD FRAME SILVER,0,0,1,0,0,0,0
82011A,"BATHROOM SCALES, TROPICAL BEACH",0,0,0,1,0,1,0
82011B,BATHROOM SCALES RUBBER DUCKS,0,0,0,0,0,1,0
82011C,BATHROOM SCALES FOOTPRINTS IN SAND,0,0,0,0,0,1,0
82095,HEART BUTTONS JEWELLERY BOX,1,0,0,1,0,0,0
82482,WOODEN PICTURE FRAME WHITE FINISH,0,1,1,0,0,0,0
82483,WOOD 2 DRAWER CABINET WHITE FINISH,0,1,1,0,0,1,0
82484,WOOD BLACK BOARD ANT WHITE FINISH,0,1,1,0,0,0,0
82486,3 DRAWER ANTIQUE WHITE WOOD CABINET,0,1,1,1,0,1,0
82486,WOOD S/3 CABINET ANT WHITE FINISH,0,1,1,0,0,1,0
82494L,WOODEN FRAME ANTIQUE WHITE ,0,1,1,1,0,0,0
82551,LAUNDRY 15C METAL SIGN,0,0,1,0,0,0,0
82552,WASHROOM METAL SIGN,0,0,1,0,0,0,0
82567,"AIRLINE LOUNGE,METAL SIGN",0,0,1,0,0,0,0
82578,KITCHEN METAL SIGN,0,0,1,0,0,1,0
82580,BATHROOM METAL SIGN,0,0,1,0,0,1,0
82581,TOILET METAL SIGN,0,0,1,0,0,0,0
82582,AREA PATROLLED METAL SIGN,0,0,1,0,0,0,0
82583,HOT BATHS METAL SIGN,0,0,1,0,0,1,0
82599,FANNY'S REST STOPMETAL SIGN,0,0,1,0,0,0,0
82600,N0 SINGING METAL SIGN,0,0,1,0,0,0,0
82600,NO SINGING METAL SIGN,0,0,1,0,0,0,0
82605,OLD DOC RUSSEL METAL SIGN,0,0,1,0,0,0,0
82613B,"METAL SIGN,CUPCAKE SINGLE HOOK",0,0,1,0,0,1,0
82613D,METAL SIGN CUPCAKE SINGLE HOOK,0,0,1,0,0,1,0
82615,PINK MARSHMALLOW SCARF KNITTING KIT,0,1,0,0,0,0,0
82616B,FRAPPUCINO SCARF KNITTING KIT,0,0,0,0,0,0,1
82616C,MIDNIGHT GLAMOUR SCARF KNITTING KIT,0,0,0,0,0,0,1
84006,MAGIC TREE -PAPER FLOWERS,0,0,1,1,0,0,0
84012,MAGIC SHEEP WOOL GROWING FROM PAPER,0,0,1,0,0,0,0
84016,FLAG OF ST GEORGE CAR FLAG,0,0,0,1,0,0,0
84029E,RED WOOLLY HOTTIE WHITE HEART.,0,1,1,1,0,0,0
84029G,KNITTED UNION FLAG HOT WATER BOTTLE,0,0,0,1,0,1,0
84030E,ENGLISH ROSE HOT WATER BOTTLE,0,0,0,0,0,1,0
84031A,CHARLIE+LOLA RED HOT WATER BOTTLE ,0,1,0,0,0,1,0
84031B,CHARLIE LOLA BLUE HOT WATER BOTTLE ,0,1,0,0,0,1,0
84032A,CHARLIE+LOLA PINK HOT WATER BOTTLE,0,1,0,0,0,1,0
84032B,CHARLIE + LOLA RED HOT WATER BOTTLE,0,1,0,0,0,1,0
84033,FLAG OF ST GEORGE ,0,0,0,1,0,0,0
84050,PINK HEART SHAPE EGG FRYING PAN,0,1,0,1,0,0,0
84051,ASS COLOUR GLOWING TIARAS,0,0,0,0,0,0,1
84077,WORLD WAR 2 GLIDERS ASSTD DESIGNS,0,0,0,1,0,0,0
84078A,SET/4 WHITE RETRO STORAGE CUBES ,1,1,0,0,0,0,0
84086B,YELLOW/BLUE RETRO RADIO,0,1,0,0,0,0,0
84086C,PINK/PURPLE RETRO RADIO,0,1,0,0,0,0,0
84192,ASSORTED COLOUR METAL CAT ,1,0,1,1,0,0,0
84199,GLOW IN DARK DOLPHINS,0,0,0,0,0,0,1
84201B,HAPPY BIRTHDAY CARD STRIPEY TEDDY,0,0,0,1,0,0,0
84201C,HAPPY BIRTHDAY CARD TEDDY/CAKE,0,0,0,1,0,0,0
84206A,3 BLACK CATS W HEARTS BLANK CARD,0,1,0,1,0,0,0
84206B,CAT WITH SUNGLASSES BLANK CARD,0,0,1,1,0,0,0
84206C,CHAMPAGNE TRAY BLANK CARD,0,0,0,0,0,0,1
84212,"ASSORTED FLOWER COLOUR ""LEIS""",1,0,0,1,0,0,0
84218,BOX/12 CHICK & EGG IN BASKET,1,0,0,0,0,0,0
84226,HEN HOUSE W FAMILY IN BARN & NEST,0,0,0,0,0,0,1
84227,HEN HOUSE W CHICK IN NEST,0,0,0,0,0,0,1
84228,HEN HOUSE W CHICK STANDING,0,0,0,0,0,0,1
84228,HEN HOUSE WITH CHICK STANDING,0,0,0,0,0,0,1
84231,EASTER BUNNY WITH BASKET ON BACK,0,0,0,0,0,0,1
84247E,PACK OF 12 CHRISTMAS FUN CARDS,1,0,0,1,0,0,0
84247E,PACK/12 XMAS FUN CARD,1,0,0,1,0,0,0
84247G,"DECOUPAGE,GREETING CARD,",0,0,0,0,0,0,1
84247L,FAWN AND MUSHROOM GREETING CARD,0,0,0,0,0,0,1
84247N,PACK/12 BLUE FOLKART CARDS,1,1,0,0,0,0,0
84249A,"GREETING CARD,SQUARE, DOUGHNUTS",0,0,0,0,0,0,1
84251B,"GREETING CARD, STICKY GORDON",0,0,0,0,0,0,1
84251C,"GREETING CARD, TWO SISTERS.",0,0,0,0,0,0,1
84251G,"GREETING CARD, OVERCROWDED POOL.",0,0,0,0,0,0,1
84270,ASSTD DESIGN BUBBLE GUM RING,0,0,0,1,1,0,0
84279B,CHERRY BLOSSOM DECORATIVE FLASK,0,0,0,1,0,0,0
84279P,CHERRY BLOSSOM  DECORATIVE FLASK,0,0,0,1,0,0,0
84306,S/3 PINK SQUARE PLANTERS ROSES,0,1,0,0,0,0,0
84313B,BLUE TV TRAY TABLE ,0,1,0,0,0,1,0
84313C,ORANGE TV TRAY TABLE ,0,1,0,0,0,1,0
84341B,SMALL PINK MAGIC CHRISTMAS TREE,0,1,0,1,0,0,0
84347,ROTATING SILVER ANGELS T-LIGHT HLDR,0,0,0,0,0,0,1
84352,SILVER CHRISTMAS TREE BAUBLE STAND ,0,0,0,1,0,0,0
84356,POMPOM CURTAIN,0,0,0,0,0,0,1
84358,FLOOR LAMP SHADE WOOD BASE,0,0,1,0,0,0,0
84360,TABLE LAMP WHITE SHADE WOOD BASE,0,1,1,0,0,1,0
84375,SET OF 20 KIDS COOKIE CUTTERS,1,0,0,0,0,0,0
84378,SET OF 3 HEART COOKIE CUTTERS,1,0,0,1,0,0,0
84380,SET OF 3 BUTTERFLY COOKIE CUTTERS,1,0,0,1,0,0,0
84387A,BIRD ON BRANCH CANVAS SCREEN,0,0,0,1,0,0,0
84388,WISE MAN STAR SHAPE EGG PAN,0,0,0,1,0,0,0
84402B,PURPLE DRESS JEWELLERY STAND,0,1,0,0,0,0,0
84406B,CREAM CUPID HEARTS COAT HANGER,0,0,0,1,0,1,0
84415A,PINK FLOCK SUEDE CUSHION COVER ,0,1,0,0,0,1,0
84415B,BLUE FLOCK CUSHION COVER ,0,1,0,0,0,1,0
84422,PINK/BLUE DISC/MIRROR STRING,0,1,0,0,1,0,0
84429A,MEDIUM PINK BUDDHA HEAD ,0,1,0,0,0,0,0
84452,METAL RABBIT LADDER EASTER ,0,0,1,0,0,0,0
84457,SET/3 RABBITS FLOWER SKIPPPING ROPE,1,0,0,1,0,0,0
84459A,PINK METAL CHICKEN HEART ,0,1,1,1,0,0,0
84459B,YELLOW METAL CHICKEN HEART ,0,1,1,1,0,0,0
84461,12 PINK HEN+CHICKS IN BASKET,0,1,0,0,0,0,0
84462,3 PINK HEN+CHICKS IN BASKET,0,1,0,0,0,0,0
84465,15 PINK FLUFFY CHICKS IN BOX,1,1,0,0,0,0,0
84466,TOP SECRET PEN SET,1,0,0,0,0,0,0
84497,BUTTONS AND STRIPES NOTEBOOK ,0,0,0,0,0,0,1
84499,BLACK FLOWER CANDLE PLATE,0,1,0,1,0,1,0
84507B,STRIPES DESIGN MONKEY DOLL,0,0,0,1,0,0,0
84507C,BLUE CIRCLES DESIGN MONKEY DOLL,0,1,0,1,0,0,0
84508A,CAMOUFLAGE DESIGN TEDDY,0,0,0,1,0,0,0
84508B,STRIPES DESIGN TEDDY,0,0,0,1,0,0,0
84508C,BLUE CIRCLES DESIGN TEDDY,0,1,0,1,0,0,0
84509A,SET OF 4 ENGLISH ROSE PLACEMATS,1,0,0,0,0,0,0
84509B,SET OF 4 FAIRY CAKE PLACEMATS,1,0,0,1,0,0,0
84509E,SET OF 4 CAROUSEL PLACEMATS ,1,0,0,0,0,0,0
84509G,SET OF 4 FAIRY CAKE PLACEMATS ,1,0,0,1,0,0,0
84509c,SET OF 4 POLKADOT PLACEMATS ,1,0,0,1,0,0,0
84510A,SET OF 4 ENGLISH ROSE COASTERS,1,0,0,0,0,0,0
84510C,SET OF 4 POLKADOT COASTERS,1,0,0,1,0,0,0
84510E,SET OF 4 GREEN CAROUSEL COASTERS,1,1,0,0,0,0,0
84519A,TOMATO CHARLIE+LOLA COASTER SET,1,0,0,0,0,0,0
84519B,CARROT CHARLIE+LOLA COASTER SET,1,0,0,0,0,0,0
84520B,PACK 20 ENGLISH ROSE PAPER NAPKINS,1,0,1,0,0,0,0
84522,PINK PARTY SUNGLASSES,0,1,1,0,0,0,0
84527,FLAMES SUNGLASSES PINK LENSES,0,1,1,0,0,0,0
84531A,PINK KNITTED EGG COSY,0,1,0,0,0,0,0
84531B,BLUE KNITTED EGG COSY,0,1,0,0,0,0,0
84534B,FAIRY CAKE NOTEBOOK A5 SIZE,0,0,0,1,0,0,0
84535A,ENGLISH ROSE NOTEBOOK A6 SIZE,0,0,0,0,0,0,1
84535B,FAIRY CAKES NOTEBOOK A6 SIZE,0,0,0,1,0,0,0
84536A,ENGLISH ROSE NOTEBOOK A7 SIZE,0,0,0,0,0,0,1
84536B,FAIRY CAKES NOTEBOOK A7 SIZE,0,0,0,1,0,0,0
84539,KNITTED RABBIT DOLL ,0,0,0,0,0,0,1
84548,CROCHET BEAR RED/BLUE  KEYRING,0,1,0,0,1,0,0
84549,CROCHET WHITE RABBIT KEYRING ,0,1,0,0,1,0,0
84550,CROCHET LILAC/RED BEAR KEYRING,0,1,0,0,1,0,0
84551,CROCHET DOG KEYRING,0,0,0,1,1,0,0
84558A,3D DOG PICTURE PLAYING CARDS,0,0,0,1,0,0,0
84559A,3D SHEET OF DOG STICKERS,0,0,0,1,0,0,0
84559B,3D SHEET OF CAT STICKERS,0,0,0,1,0,0,0
84562A,PINK/WHITE RIBBED MELAMINE JUG,0,1,0,0,0,1,0
84563A,PINK & WHITE BREAKFAST TRAY,0,1,0,0,0,0,0
84563B,BLUE & WHITE BREAKFAST TRAY,0,1,0,0,0,0,0
84568,GIRLS ALPHABET IRON ON PATCHES ,0,0,0,1,0,0,0
84569A,PACK 3 IRON ON DOG PATCHES,1,0,0,1,0,0,0
84569B,PACK 3 FIRE ENGINE/CAR PATCHES,1,0,0,0,0,0,0
84569C,PACK 4 FLOWER/BUTTERFLY PATCHES,1,0,0,1,0,0,0
84569D,PACK 6 HEART/ICE-CREAM PATCHES,1,0,0,1,0,0,0
84575A,PINK DOG CANNISTER,0,1,0,1,0,0,0
84576,BLUE CAT BISCUIT BARREL PINK HEART,0,1,0,1,0,0,0
84580,MOUSE TOY WITH PINK T-SHIRT,0,1,0,0,0,0,0
84581,DOG TOY WITH PINK CROCHET SKIRT,0,1,0,1,0,0,0
84584,PINK GINGHAM CAT WITH SCARF,0,1,0,1,0,0,0
84592,CROCHET ROSE PURSE WITH SUEDE BACK,0,0,0,0,0,0,1
84593,CROCHET ROSE DES CLOTHES HANGER,0,0,0,0,0,1,0
84595E,LARGE TORTILLA DESIGN RED BOWL,0,1,0,1,0,0,0
84596B,SMALL DOLLY MIX DESIGN ORANGE BOWL,0,1,0,1,0,0,0
84596E,SMALL LICORICE DES PINK BOWL,0,1,0,0,0,0,0
84596F,SMALL MARSHMALLOWS PINK BOWL,0,1,0,0,0,0,0
84596G,SMALL CHOCOLATES PINK BOWL,0,1,0,0,0,0,0
84596J,MIXED NUTS LIGHT GREEN BOWL,0,1,0,0,0,0,0
84596L,BISCUITS SMALL BOWL LIGHT BLUE,0,1,0,0,0,0,0
84597B,RETRO BROWN BALL ASHTRAY ,0,0,0,0,0,0,1
84597C,RETRO PINK BALL ASHTRAY ,0,1,0,0,0,0,0
84598,BOYS ALPHABET IRON ON PATCHES,0,0,0,1,0,0,0
84600,NEW BAROQUE JEWELLERY BOX ,1,0,0,0,0,0,0
84609,TALL ROCOCO CANDLE HOLDER,0,0,0,0,0,1,0
84613A,PINK NEW BAROQUE FLOCK CANDLESTICK,0,1,0,0,0,1,0
84613C,BLUE NEW BAROQUE FLOCK CANDLESTICK,0,1,0,0,0,1,0
84614A,PINK BAROQUE FLOCK CANDLE HOLDER,0,1,0,0,0,1,0
84616,SILVER ROCCOCO CHANDELIER,0,0,0,0,0,0,1
84617,NEW BAROQUE BLACK BOXES,1,1,0,0,0,0,0
84620,BLUE GINGHAM ROSE CUSHION COVER,0,1,0,0,0,1,0
84625A,PINK NEW BAROQUECANDLESTICK CANDLE,0,1,0,0,0,1,0
84625C,BLUE NEW BAROQUE CANDLESTICK CANDLE,0,1,0,0,0,1,0
84629,WHITE 3 FRAME BIRDS AND TREE ,0,1,0,1,0,0,0
84631,FRUIT TREE AND BIRDS WALL PLAQUE,0,0,0,1,0,0,0
84632,DECORATIVE HANGING SHELVING UNIT,0,0,0,0,0,0,1
84637,KITCHEN FLOWER POTS WALL PLAQUE,0,0,0,1,0,1,0
84638,SMALL KITCHEN FLOWER POTS PLAQUE,0,0,0,1,0,1,0
84658,WHITE STITCHED CUSHION COVER,0,1,0,0,0,1,0
84659A,WHITE TRAVEL ALARM CLOCK,0,1,0,0,0,1,0
84660A,WHITE STITCHED WALL CLOCK,0,1,0,0,0,1,0
84660C,PINK STITCHED WALL CLOCK,0,1,0,0,0,1,0
84660b,BLACK STITCHED WALL CLOCK,0,1,0,0,0,1,0
84661A,WHITE SQUARE TABLE CLOCK,0,1,0,0,0,1,0
84661B,BLACK SQUARE TABLE CLOCK,0,1,0,0,0,1,0
84661C,PINK SQUARE TABLE CLOCK,0,1,0,0,0,1,0
84663A,GRASS HOPPER WOODEN WALL CLOCK ,0,0,1,0,0,1,0
84665,SQUARE CHERRY BLOSSOM CABINET,0,0,0,1,0,1,0
84673A,PINK FLY SWAT,0,1,0,0,0,0,0
84673B,BLUE FLY SWAT,0,1,0,0,0,0,0
84674,FLYING PIG WATERING CAN,0,0,0,0,1,0,0
84675,FROG KING WATERING CAN,0,0,0,0,1,0,0
84678,CLASSICAL ROSE SMALL VASE,0,0,0,0,0,0,1
84679,CLASSICAL ROSE TABLE LAMP,0,0,0,0,0,1,0
84683,CLASSICAL ROSE CANDLESTAND,0,0,0,0,0,1,0
84685,BEACH HUT KEY CABINET,0,0,0,0,0,1,0
84686,BEACH HUT MIRROR,0,0,0,0,0,0,1
84687,BEACH HUT SHELF W 3 DRAWERS,0,0,0,0,0,0,1
84688,BEACH HUT DESIGN BLACKBOARD,0,1,0,1,0,0,0
84689,S/2 BEACH HUT TREASURE CHESTS,0,0,0,0,0,0,1
84691,PACK 20 DOLLY PEGS,1,0,0,0,0,0,0
84692,BOX OF 24 COCKTAIL PARASOLS,1,0,0,0,0,0,0
84705C,PINK FLOCK PHOTO FRAME ,0,1,0,0,0,0,0
84706D,CHERRY BLOSSOM TABLE CLOCK ,0,0,0,1,0,1,0
84706F,RED PEONY TABLE CLOCK,0,1,0,0,0,1,0
84707A,SILVER JEWELLED MIRROR TRINKET TRAY,0,0,0,0,0,0,1
84707B,PINK JEWELLED MIRROR TRINKET TRAY,0,1,0,0,0,0,0
84708B,PINK JEWELLED PHOTO FRAME ,0,1,0,0,0,0,0
84709B,PINK OVAL JEWELLED MIRROR,0,1,0,0,0,0,0
84711A,SILVER OVAL SHAPE TRINKET BOX,1,0,0,0,0,0,0
84711B,PINK OVAL SHAPE TRINKET BOX,1,1,0,0,0,0,0
84712B,PINK JEWELLED PHOTO FRAME,0,1,0,0,0,0,0
84715,SET OF 6 ICE CREAM SKITTLES,1,0,0,0,0,0,0
84723,CHERRY BLOSSOM CANVAS ART PICTURE,0,0,0,1,0,0,0
84725,FREESTYLE CANVAS ART PICTURE,0,0,0,0,0,0,1
84731,3 BIRDS CANVAS SCREEN,0,0,0,1,0,0,0
84732B,CUTE BIRD CEATURE SCREEN,0,0,0,1,0,0,0
84732D,CUTE RABBIT CEATURE SCREEN ,0,0,0,0,0,0,1
84741C,CITRUS GARLAND FELT FLOWERS ,0,0,0,1,0,0,0
84743C,ORANGE FELT VASE + FLOWERS,0,1,0,1,0,0,0
84744,S/6 SEW ON CROCHET FLOWERS,0,0,0,1,0,0,0
84745A,PINK HANGING GINGHAM EASTER HEN,0,1,0,0,0,0,0
84745B,BLUE HANGING GINGHAM EASTER HEN,0,1,0,0,0,0,0
84746,PINK EASTER HENS+FLOWER,0,1,0,1,0,0,0
84748,FOLK FELT HANGING MULTICOL GARLAND,0,0,0,0,0,0,1
84750A,PINK SMALL GLASS CAKE STAND,0,1,1,0,0,0,0
84750B,BLACK SMALL GLASS CAKE STAND,0,1,1,0,0,0,0
84751B,BLACK MEDIUM GLASS CAKE STAND,0,1,1,0,0,0,0
84754,S/15 SILVER GLASS BAUBLES IN BAG,0,0,1,0,0,0,0
84755,COLOUR GLASS T-LIGHT HOLDER HANGING,0,0,1,0,0,0,0
