StockCode,Description,SETS,Colors,Material,Design,Jewelry,Household,MISC
22176,BLUE OWL SOFT TOY,0,1,0,0,0,0,0
22178,VICTORIAN GLASS HANGING T-LIGHT,0,0,1,0,0,0,0
22179,SET 10 LIGHTS NIGHT OWL,1,0,0,0,0,0,0
22179,SET 10 NIGHT OWL LIGHTS,1,0,0,0,0,0,0
22180,RETROSPOT LAMP,0,0,0,1,0,1,0
22181,SNOWSTORM PHOTO FRAME FRIDGE MAGNET,0,0,0,0,0,0,1
22182,CAKE STAND VICTORIAN FILIGREE SMALL,0,0,0,0,0,0,1
22183,CAKE STAND VICTORIAN FILIGREE MED,0,0,0,0,0,0,1
22184,CAKE STAND VICTORIAN FILIGREE LARGE,0,0,0,0,0,0,1
22185,SLATE TILE NATURAL HANGING,0,0,0,0,0,0,1
22186,RED STAR CARD HOLDER,0,1,0,1,0,0,0
22187,GREEN CHRISTMAS TREE CARD HOLDER,0,1,0,1,0,0,0
22188,BLACK HEART CARD HOLDER,0,1,0,1,0,0,0
22189,CREAM HEART CARD HOLDER,0,0,0,1,0,0,0
22190,LOCAL CAFE MUG,0,0,0,0,0,1,0
22191,IVORY DINER WALL CLOCK,0,0,0,0,0,1,0
22192,BLUE DINER WALL CLOCK,0,1,0,0,0,1,0
22193,RED DINER WALL CLOCK,0,1,0,0,0,1,0
22194,BLACK DINER WALL CLOCK,0,1,0,0,0,1,0
22195,LARGE HEART MEASURING SPOONS,0,0,0,1,1,1,0
22196,SMALL HEART MEASURING SPOONS,0,0,0,1,1,1,0
22197,POPCORN HOLDER,0,0,0,0,0,0,1
22197,SMALL POPCORN HOLDER,0,0,0,0,0,0,1
22198,LARGE POPCORN HOLDER ,0,0,0,0,0,0,1
22199,FRYING PAN RED POLKADOT ,0,1,0,1,0,0,0
22199,FRYING PAN RED RETROSPOT,0,1,0,1,0,1,0
22200,FRYING PAN PINK POLKADOT,0,1,0,1,0,0,0
22201,FRYING PAN BLUE POLKADOT,0,1,0,1,0,0,0
22202,MILK PAN PINK POLKADOT,0,1,0,1,0,0,0
22203,MILK PAN RED RETROSPOT,0,1,0,1,0,1,0
22204,MILK PAN BLUE POLKADOT,0,1,0,1,0,0,0
22206,"MUG , DOTCOMGIFTSHOP.COM ",0,0,0,0,0,1,0
22207,FRYING PAN UNION FLAG,0,0,0,1,0,0,0
22208,WOOD STAMP SET THANK YOU,1,0,1,0,0,0,0
22209,WOOD STAMP SET HAPPY BIRTHDAY,1,0,1,1,0,0,0
22210,WOOD STAMP SET BEST WISHES,1,0,1,0,0,0,0
22211,WOOD STAMP SET FLOWERS,1,0,1,1,0,0,0
22212,FOUR HOOK  WHITE LOVEBIRDS,0,1,0,1,0,0,0
22214,CANDLE PLATE LACE WHITE,0,1,0,0,0,1,0
22215,CAKE STAND WHITE TWO TIER LACE,0,1,0,0,0,0,0
22216,T-LIGHT HOLDER WHITE LACE,0,1,0,0,0,0,0
22217,T-LIGHT HOLDER HANGING LACE,0,0,0,0,0,0,1
22218,CAKE STAND LACE WHITE,0,1,0,0,0,0,0
22219,LOVEBIRD HANGING DECORATION WHITE ,0,1,0,1,0,0,0
22220,CAKE STAND LOVEBIRD 2 TIER WHITE,0,1,0,1,0,0,0
22221,CAKE STAND LOVEBIRD 2 TIER PINK,0,1,0,1,0,0,0
22222,CAKE PLATE LOVEBIRD WHITE,0,1,0,1,0,1,0
22223,CAKE PLATE LOVEBIRD PINK,0,1,0,1,0,1,0
22224,WHITE LOVEBIRD LANTERN,0,1,0,1,0,0,0
22227,HANGING HEART MIRROR DECORATION ,0,0,0,1,0,0,0
22228,BUNNY WOODEN PAINTED WITH BIRD ,0,0,1,1,0,0,0
22229,BUNNY WOODEN PAINTED WITH FLOWER ,0,0,1,1,0,0,0
22230,JIGSAW TREE WITH WATERING CAN,0,0,0,1,1,0,0
22231,JIGSAW TREE WITH BIRDHOUSE,0,0,0,1,0,0,0
22232,JIGSAW TOADSTOOLS 3 PIECE,0,0,0,0,0,0,1
22233,JIGSAW RABBIT AND BIRDHOUSE,0,0,0,1,0,0,0
22236,CAKE STAND 3 TIER MAGIC GARDEN,0,0,0,0,0,1,0
22241,GARLAND WOODEN HAPPY EASTER,0,0,1,0,0,0,0
22242,5 HOOK HANGER MAGIC TOADSTOOL,0,0,0,0,0,1,0
22243,5 HOOK HANGER RED MAGIC TOADSTOOL,0,1,0,0,0,1,0
22244,3 HOOK HANGER MAGIC GARDEN,0,0,0,0,0,1,0
22245,"HOOK, 1 HANGER ,MAGIC GARDEN",0,0,0,0,0,1,0
22246,"GARLAND, MAGIC GARDEN 1.8M",0,0,0,0,0,1,0
22246,MAGIC GARDEN FELT GARLAND ,0,0,0,0,0,1,0
22247,BUNNY DECORATION MAGIC GARDEN,0,0,0,0,0,1,0
22248,DECORATION  PINK CHICK MAGIC GARDEN,0,1,0,0,0,1,0
22249,DECORATION WHITE CHICK MAGIC GARDEN,0,1,0,0,0,1,0
22250,DECORATION  BUTTERFLY  MAGIC GARDEN,0,0,0,1,0,1,0
22251,BIRDHOUSE DECORATION MAGIC GARDEN,0,0,0,1,0,1,0
22252,BIRDCAGE DECORATION TEALIGHT HOLDER,0,0,0,1,0,0,0
22254,FELT TOADSTOOL LARGE,0,0,0,0,0,0,1
22255,FELT TOADSTOOL  SMALL,0,0,0,0,0,0,1
22256,FELT FARM ANIMAL CHICKEN,0,0,0,1,0,0,0
22257,FELT FARM ANIMAL SHEEP,0,0,0,1,0,0,0
22258,FELT FARM ANIMAL RABBIT,0,0,0,1,0,0,0
22259,FELT FARM ANIMAL HEN,0,0,0,1,0,0,0
22260,FELT EGG COSY BLUE RABBIT ,0,1,0,0,0,0,0
22261,FELT EGG COSY WHITE RABBIT ,0,1,0,0,0,0,0
22262,FELT EGG COSY CHICKEN,0,0,0,0,0,0,1
22263,FELT EGG COSY LADYBIRD ,0,0,0,1,0,0,0
22264,FELT FARM ANIMAL WHITE BUNNY ,0,1,0,1,0,0,0
22265,EASTER DECORATION NATURAL CHICK,0,0,0,0,0,0,1
22266,EASTER DECORATION HANGING BUNNY,0,0,0,0,0,0,1
22267,EASTER DECORATION EGG BUNNY ,0,0,0,0,0,0,1
22268,DECORATION SITTING BUNNY,0,0,0,0,0,0,1
22268,EASTER DECORATION SITTING BUNNY,0,0,0,0,0,0,1
22269,EGG CUP NATURAL CHICKEN,0,0,0,0,0,1,0
22270,HAPPY EASTER HANGING DECORATION,0,0,0,0,0,0,1
22271,FELTCRAFT DOLL ROSIE,0,0,1,0,0,0,0
22272,FELTCRAFT DOLL MARIA,0,0,1,0,0,0,0
22273,FELTCRAFT DOLL MOLLY,0,0,1,0,0,0,0
22274,FELTCRAFT DOLL EMILY,0,0,1,0,0,0,0
22275,WEEKEND BAG VINTAGE ROSE PAISLEY,0,0,0,1,0,0,0
22276,WASH BAG VINTAGE ROSE PAISLEY,0,0,0,1,0,0,0
22277,COSMETIC BAG VINTAGE ROSE PAISLEY,0,0,0,1,0,0,0
22278,OVERNIGHT BAG VINTAGE ROSE PAISLEY,0,0,0,1,0,0,0
22279,POCKET BAG BLUE PAISLEY RED SPOT,0,1,0,0,0,1,0
22280,POCKET BAG PINK PAISELY BROWN SPOT,0,1,0,0,0,1,0
22281,EASTER TREE YELLOW BIRDS,0,1,0,1,0,0,0
22282,12 EGG HOUSE PAINTED WOOD,0,0,1,0,0,0,0
22283,6 EGG HOUSE PAINTED WOOD,0,0,1,0,0,0,0
22284,HEN HOUSE DECORATION,0,0,0,0,0,0,1
22285,"DECORATION HEN ON NEST, HANGING",0,0,0,0,0,0,1
22285,HANGING HEN ON NEST DECORATION,0,0,0,0,0,0,1
22286,"DECORATION , WOBBLY RABBIT , METAL ",0,0,1,0,0,0,0
22286,DECORATION WOBBLY RABBIT METAL ,0,0,1,0,0,0,0
22287,"DECORATION , WOBBLY CHICKEN, METAL ",0,0,1,0,0,0,0
22287,DECORATION WOBBLY CHICKEN,0,0,0,0,0,0,1
22288,HANGING METAL RABBIT DECORATION,0,0,1,0,0,0,0
22289,HANGING METAL CHICKEN DECORATION,0,0,1,0,0,0,0
22291,HANGING CHICK CREAM DECORATION,0,0,0,0,0,0,1
22292,HANGING CHICK  YELLOW DECORATION,0,1,0,0,0,0,0
22293,HANGING CHICK GREEN DECORATION,0,1,0,0,0,0,0
22294,HEART FILIGREE DOVE  SMALL,0,0,0,1,0,0,0
22295,HEART FILIGREE DOVE LARGE,0,0,0,1,0,0,0
22296,HEART IVORY TRELLIS LARGE,0,0,0,1,0,0,0
22297,HEART IVORY TRELLIS SMALL,0,0,0,1,0,0,0
22299,PIG KEYRING WITH LIGHT & SOUND ,0,0,0,0,1,0,0
22300,COFFEE MUG DOG + BALL DESIGN,0,0,0,1,0,1,0
22301,COFFEE MUG CAT + BIRD DESIGN,0,0,0,1,0,1,0
22302,COFFEE MUG PEARS  DESIGN,0,0,0,1,0,1,0
22303,COFFEE MUG APPLES DESIGN,0,0,0,1,0,1,0
22304,COFFEE MUG BLUE PAISLEY DESIGN,0,1,0,1,0,1,0
22305,COFFEE MUG PINK PAISLEY DESIGN,0,1,0,1,0,1,0
22306,SILVER MUG BONE CHINA TREE OF LIFE,0,0,0,1,0,1,0
22307,GOLD MUG BONE CHINA TREE OF LIFE,0,0,0,1,0,1,0
22308,TEA COSY BLUE STRIPE,0,1,0,0,0,0,0
22309,TEA COSY RED  STRIPE,0,1,0,0,0,0,0
22310,IVORY KNITTED MUG COSY ,0,0,0,0,0,1,0
22311,OFFICE MUG WARMER BLACK+SILVER ,0,1,0,0,0,1,0
22312,OFFICE MUG WARMER POLKADOT,0,0,0,1,0,1,0
22313,OFFICE MUG WARMER PINK,0,1,0,0,0,1,0
22314,OFFICE MUG WARMER CHOC+BLUE,0,1,0,0,0,1,0
22315,200 RED + WHITE BENDY STRAWS,0,1,0,0,0,0,0
22316,200 BENDY SKULL STRAWS,0,0,0,1,0,0,0
22317,FIVE CATS HANGING DECORATION,0,0,0,1,0,0,0
22318,FIVE HEART HANGING DECORATION,0,0,0,1,0,0,0
22319,HAIRCLIPS FORTIES FABRIC ASSORTED,1,0,0,0,0,0,0
22320,BIRDS MOBILE VINTAGE DESIGN,0,0,0,1,0,0,0
22321,BIRD DECORATION RED RETROSPOT,0,1,0,1,0,1,0
22322,BIRD DECORATION GREEN POLKADOT,0,1,0,1,0,0,0
22323,PINK POLKADOT KIDS BAG,0,1,0,1,0,0,0
22324,BLUE POLKADOT KIDS BAG,0,1,0,1,0,0,0
22325,MOBILE VINTAGE HEARTS ,0,0,0,1,0,0,0
22326,ROUND SNACK BOXES SET OF4 WOODLAND ,1,0,1,0,0,0,0
22327,ROUND SNACK BOXES SET OF 4 SKULLS,1,0,0,1,0,0,0
22328,ROUND SNACK BOXES SET OF 4 FRUITS ,1,0,0,0,0,0,0
22329,ROUND CONTAINER SET OF 5 RETROSPOT,1,0,0,1,0,1,0
22331,WOODLAND PARTY BAG + STICKER SET,1,0,1,0,0,0,0
22332,SKULLS PARTY BAG + STICKER SET,1,0,0,1,0,0,0
22333,RETROSPOT PARTY BAG + STICKER SET,1,0,0,1,0,1,0
22334,DINOSAUR PARTY BAG + STICKER SET,1,0,0,0,0,0,0
22335,HEART DECORATION PAINTED ZINC ,0,0,0,1,0,0,0
22336,DOVE DECORATION PAINTED ZINC ,0,0,0,0,0,0,1
22337,ANGEL DECORATION PAINTED ZINC ,0,0,0,0,0,0,1
22338,STAR DECORATION PAINTED ZINC ,0,0,0,1,0,0,0
22339,CHRISTMAS TREE PAINTED ZINC ,0,0,0,1,0,0,0
22340,NOEL GARLAND PAINTED ZINC ,0,0,0,0,0,0,1
22341,LOVE GARLAND PAINTED ZINC ,0,0,0,0,0,0,1
22342,HOME GARLAND PAINTED ZINC ,0,0,0,0,0,1,0
22343,PARTY PIZZA DISH RED RETROSPOT,0,1,0,1,0,1,0
22344,PARTY PIZZA DISH PINK POLKADOT,0,1,0,1,0,0,0
22345,PARTY PIZZA DISH BLUE POLKADOT,0,1,0,1,0,0,0
22346,PARTY PIZZA DISH GREEN POLKADOT,0,1,0,1,0,0,0
22348,TEA BAG PLATE RED RETROSPOT,0,1,0,1,0,1,0
22349,DOG BOWL CHASING BALL DESIGN,0,0,0,1,0,0,0
22350,ILLUSTRATED CAT BOWL ,0,0,0,1,0,0,0
22351,DOTCOMGIFTSHOP TEA TOWEL,0,0,0,0,0,1,0
22352,LUNCH BOX WITH CUTLERY RETROSPOT ,1,0,0,1,0,1,0
22353,LUNCH BOX WITH CUTLERY FAIRY CAKES ,1,0,0,1,0,1,0
22354,RETROSPOT PADDED SEAT CUSHION,0,0,0,1,0,1,0
22355,CHARLOTTE BAG SUKI DESIGN,0,0,0,1,0,0,0
22356,CHARLOTTE BAG PINK POLKADOT,0,1,0,1,0,0,0
22357,KINGS CHOICE BISCUIT TIN,0,0,0,0,0,0,1
22358,KINGS CHOICE TEA CADDY ,0,0,0,0,0,0,1
22359,GLASS JAR KINGS CHOICE,0,0,1,0,0,1,0
22360,GLASS JAR ENGLISH CONFECTIONERY,0,0,1,0,0,1,0
22361,GLASS JAR DAISY FRESH COTTON WOOL,0,0,1,1,0,1,0
22362,GLASS JAR PEACOCK BATH SALTS,0,0,1,0,0,1,0
22363,GLASS JAR MARMALADE ,0,0,1,0,0,1,0
22364,GLASS JAR DIGESTIVE BISCUITS,0,0,1,0,0,1,0
22365,DOORMAT RESPECTABLE HOUSE,0,0,0,0,0,1,0
22366,DOORMAT AIRMAIL ,0,0,0,0,0,1,0
22367,CHILDRENS APRON SPACEBOY DESIGN,0,0,0,1,0,0,0
22371,AIRLINE BAG VINTAGE TOKYO 78,0,0,0,1,0,0,0
22372,AIRLINE BAG VINTAGE WORLD CHAMPION ,0,0,0,1,0,0,0
22374,AIRLINE BAG VINTAGE JET SET RED,1,1,0,1,0,0,0
22375,AIRLINE BAG VINTAGE JET SET BROWN,1,0,0,1,0,0,0
22376,AIRLINE BAG VINTAGE JET SET WHITE,1,1,0,1,0,0,0
22377,BOTTLE BAG RETROSPOT ,0,0,0,1,0,1,0
22378,WALL TIDY RETROSPOT ,0,0,0,1,0,1,0
22379,RECYCLING BAG RETROSPOT ,0,0,0,1,0,1,0
22380,TOY TIDY SPACEBOY  ,0,0,0,0,0,0,1
22381,TOY TIDY PINK POLKADOT,0,1,0,1,0,0,0
22382,LUNCH BAG SPACEBOY DESIGN ,0,0,0,1,0,0,0
22383,LUNCH BAG SUKI  DESIGN ,0,0,0,1,0,0,0
22383,LUNCH BAG SUKI DESIGN ,0,0,0,1,0,0,0
22384,LUNCH BAG PINK POLKADOT,0,1,0,1,0,0,0
22385,JUMBO BAG SPACEBOY DESIGN,0,0,0,1,0,0,0
22386,JUMBO BAG PINK POLKADOT,0,1,0,1,0,0,0
22389,PAPERWEIGHT SAVE THE PLANET,0,0,1,0,0,0,0
22390,PAPERWEIGHT CHILDHOOD MEMORIES,0,0,1,0,0,0,0
22391,PAPERWEIGHT HOME SWEET HOME,0,0,1,0,0,1,0
22393,PAPERWEIGHT VINTAGE COLLAGE,0,0,1,1,0,0,0
22394,PAPERWEIGHT KINGS CHOICE ,0,0,1,0,0,0,0
22395,PAPERWEIGHT VINTAGE PAISLEY,0,0,1,1,0,0,0
22396,MAGNETS PACK OF 4 RETRO PHOTO,1,0,0,0,0,0,0
22398,MAGNETS PACK OF 4 SWALLOWS,1,0,0,0,0,0,0
22399,MAGNETS PACK OF 4 CHILDHOOD MEMORY,1,0,0,0,0,0,0
22400,MAGNETS PACK OF 4 HOME SWEET HOME,1,0,0,0,0,1,0
22402,MAGNETS PACK OF 4 VINTAGE COLLAGE,1,0,0,1,0,0,0
22403,MAGNETS PACK OF 4 VINTAGE LABELS ,1,0,0,1,0,0,0
22405,MONEY BOX POCKET MONEY DESIGN,1,0,0,1,0,0,0
22406,MONEY BOX KINGS CHOICE DESIGN,1,0,0,1,0,0,0
22407,MONEY BOX FIRST ADE DESIGN,1,0,0,1,0,0,0
22407,MONEY BOX FIRST AID DESIGN,1,0,0,1,0,0,0
22408,MONEY BOX CONFECTIONERY DESIGN,1,0,0,1,0,0,0
22409,MONEY BOX BISCUITS DESIGN,1,0,0,1,0,0,0
22410,MONEY BOX HOUSEKEEPING DESIGN,1,0,0,1,0,0,0
22411,JUMBO SHOPPER VINTAGE RED PAISLEY,0,1,0,1,0,0,0
22412,METAL SIGN NEIGHBOURHOOD WITCH ,0,0,1,0,0,0,0
22413,METAL SIGN TAKE IT OR LEAVE IT ,0,0,1,0,0,0,0
22414,DOORMAT NEIGHBOURHOOD WITCH ,0,0,0,0,0,1,0
22415,WHITE TISSUE REAM,0,1,0,0,0,0,0
22416,SET OF 36 DOILIES SPACEBOY DESIGN ,1,0,0,1,0,0,0
22416,SET OF 36 SPACEBOY PAPER DOILIES,1,0,1,0,0,0,0
22417,PACK OF 60 SPACEBOY CAKE CASES,1,0,0,0,0,0,0
22418,10 COLOUR SPACEBOY PEN,0,0,0,0,0,0,1
22419,LIPSTICK PEN RED,0,1,0,0,0,0,0
22420,LIPSTICK PEN BABY PINK,0,1,0,0,0,0,0
22421,LIPSTICK PEN FUSCHIA,0,0,0,0,0,0,1
22422,TOOTHPASTE TUBE PEN,0,0,0,0,0,0,1
22423,REGENCY CAKESTAND 3 TIER,0,0,0,0,0,0,1
22424,ENAMEL BREAD BIN CREAM,0,0,0,0,0,0,1
22425,ENAMEL COLANDER CREAM,0,0,0,0,0,0,1
22426,ENAMEL WASH BOWL CREAM,0,0,0,0,0,0,1
22427,ENAMEL FLOWER JUG CREAM,0,0,0,1,0,1,0
22428,ENAMEL FIRE BUCKET CREAM,0,0,0,0,0,0,1
22429,ENAMEL MEASURING JUG CREAM,0,0,0,0,1,1,0
22430,ENAMEL WATERING CAN CREAM,0,0,0,0,1,0,0
22431,WATERING CAN BLUE ELEPHANT,0,1,0,0,1,0,0
22432,WATERING CAN PINK BUNNY,0,1,0,0,1,0,0
22433,WATERING CAN GREEN DINOSAUR,0,1,0,0,1,0,0
22434,BALLOON PUMP WITH 10 BALLOONS,0,0,0,0,0,0,1
22435,SET OF 9 HEART SHAPED BALLOONS,1,0,0,1,0,0,0
22436,12 COLOURED PARTY BALLOONS,0,1,0,0,0,0,0
22437,SET OF 9 BLACK SKULL BALLOONS,1,1,0,1,0,0,0
22438,BALLOON ART MAKE YOUR OWN FLOWERS,0,0,0,1,0,0,0
22439,6 ROCKET BALLOONS ,0,0,0,0,0,0,1
22440,BALLOON WATER BOMB PACK OF 35,1,0,0,0,0,0,0
22441,GROW YOUR OWN BASIL IN ENAMEL MUG,0,0,0,0,0,1,0
22442,GROW YOUR OWN FLOWERS SET OF 3,1,0,0,1,0,0,0
22443,GROW YOUR OWN HERBS SET OF 3,1,0,0,0,0,1,0
22444,GROW YOUR OWN PLANT IN A CAN ,0,0,0,0,0,0,1
22445,PENCIL CASE LIFE IS BEAUTIFUL,0,0,0,0,0,0,1
22446,PIN CUSHION BABUSHKA PINK,0,1,0,0,0,1,0
22447,PIN CUSHION BABUSHKA BLUE,0,1,0,0,0,1,0
22448,PIN CUSHION BABUSHKA RED,0,1,0,0,0,1,0
22449,SILK PURSE BABUSHKA PINK,0,1,0,0,0,0,0
22450,SILK PURSE BABUSHKA BLUE,0,1,0,0,0,0,0
22451,SILK PURSE BABUSHKA RED,0,1,0,0,0,0,0
22452,MEASURING TAPE BABUSHKA PINK,0,1,0,0,1,0,0
22453,MEASURING TAPE BABUSHKA BLUE,0,1,0,0,1,0,0
22454,MEASURING TAPE BABUSHKA RED,0,1,0,0,1,0,0
22456,NATURAL SLATE CHALKBOARD LARGE ,0,0,0,0,0,0,1
22457,NATURAL SLATE HEART CHALKBOARD ,0,0,0,1,0,0,0
22458,CAST IRON HOOK GARDEN FORK,0,0,0,0,0,1,0
22459,CAST IRON HOOK GARDEN TROWEL,0,0,0,0,0,1,0
22460,EMBOSSED GLASS TEALIGHT HOLDER,0,0,1,0,0,0,0
22461,SAVOY ART DECO CLOCK,0,0,0,0,0,1,0
22464,HANGING METAL HEART LANTERN,0,0,1,1,0,0,0
22465,HANGING METAL STAR LANTERN,0,0,1,1,0,0,0
22466,FAIRY TALE COTTAGE NIGHT LIGHT,0,0,0,1,0,0,0
22466,FAIRY TALE COTTAGE NIGHTLIGHT,0,0,0,1,0,0,0
22467,GUMBALL COAT RACK,0,0,0,0,0,0,1
22468,BABUSHKA LIGHTS STRING OF 10,0,0,0,0,1,0,0
22469,HEART OF WICKER SMALL,0,0,0,1,0,0,0
22470,HEART OF WICKER LARGE,0,0,0,1,0,0,0
22471,TV DINNER TRAY AIR HOSTESS ,0,0,0,0,0,0,1
22472,TV DINNER TRAY DOLLY GIRL,0,0,0,0,0,0,1
22473,TV DINNER TRAY VINTAGE PAISLEY,0,0,0,1,0,0,0
22474,SPACEBOY TV DINNER TRAY,0,0,0,0,0,0,1
22475,SKULL DESIGN TV DINNER TRAY,0,0,0,1,0,0,0
22476,EMPIRE UNION JACK TV DINNER TRAY,0,0,0,0,0,0,1
22477,WATERING CAN GARDEN MARKER,0,0,0,0,1,1,0
22478,BIRDHOUSE GARDEN MARKER ,0,0,0,1,0,1,0
22479,DAISY GARDEN MARKER,0,0,0,1,0,1,0
22480,RED TEA TOWEL CLASSIC DESIGN,0,1,0,1,0,0,0
22481,BLACK TEA TOWEL CLASSIC DESIGN,0,1,0,1,0,0,0
22482,BLUE TEA TOWEL CLASSIC DESIGN,0,1,0,1,0,0,0
22483,RED GINGHAM TEDDY BEAR ,0,1,0,0,0,0,0
22485,SET OF 2 WOODEN MARKET CRATES,1,0,1,0,0,0,0
22486,PLASMATRONIC LAMP,0,0,0,0,0,0,1
22487,WHITE WOOD GARDEN PLANT LADDER,0,1,1,0,0,1,0
22488,NATURAL SLATE RECTANGLE CHALKBOARD,0,0,0,0,0,0,1
22489,PACK OF 12 TRADITIONAL CRAYONS,1,0,0,1,0,0,0
22491,PACK OF 12 COLOURED PENCILS,1,1,0,0,0,0,0
22492,MINI PAINT SET VINTAGE ,1,0,0,1,0,0,0
22493,PAINT YOUR OWN CANVAS SET,1,0,0,0,0,0,0
22494,EMERGENCY FIRST AID TIN ,0,0,0,0,0,0,1
22495,SET OF 2 ROUND TINS CAMEMBERT ,1,0,0,0,0,0,0
22496,SET OF 2 ROUND TINS DUTCH CHEESE,1,0,0,0,0,0,0
22497,SET OF 2 TINS VINTAGE BATHROOM ,1,0,0,1,0,1,0
22498,WOODEN REGATTA BUNTING,0,0,1,0,0,0,0
22499,WOODEN UNION JACK BUNTING,0,0,1,0,0,0,0
22500,SET OF 2 TINS JARDIN DE PROVENCE,1,0,0,0,0,1,0
22501,PICNIC BASKET WICKER LARGE,0,0,0,0,0,0,1
22502,PICNIC BASKET WICKER 60 PIECES,0,0,0,0,0,0,1
22502,PICNIC BASKET WICKER SMALL,0,0,0,0,0,0,1
22503,CABIN BAG VINTAGE PAISLEY,0,0,0,1,0,0,0
22504,CABIN BAG VINTAGE RETROSPOT,0,0,0,1,0,1,0
22505,MEMO BOARD COTTAGE DESIGN,0,0,0,1,0,0,0
22507,MEMO BOARD RETROSPOT  DESIGN,0,0,0,1,0,1,0
22508,DOORSTOP RETROSPOT HEART,0,0,0,1,0,1,0
22509,SEWING BOX RETROSPOT DESIGN ,1,0,0,1,0,1,0
22510,GINGHAM BABUSHKA DOORSTOP,0,0,0,0,0,0,1
22511,RETROSPOT BABUSHKA DOORSTOP,0,0,0,1,0,1,0
22512,DOORSTOP RACING CAR DESIGN,0,0,0,1,0,0,0
22513,DOORSTOP FOOTBALL DESIGN,0,0,0,1,0,0,0
22514,CHILDS GARDEN SPADE BLUE,0,1,0,0,0,1,0
22515,CHILDS GARDEN SPADE PINK,0,1,0,0,0,1,0
22516,CHILDS GARDEN RAKE BLUE,0,1,0,0,0,1,0
22517,CHILDS GARDEN RAKE PINK,0,1,0,0,0,1,0
22518,CHILDS GARDEN BRUSH BLUE,0,1,0,0,0,1,0
22519,CHILDS GARDEN BRUSH PINK,0,1,0,0,0,1,0
22520,CHILDS GARDEN TROWEL BLUE ,0,1,0,0,0,1,0
22521,CHILDS GARDEN TROWEL PINK,0,1,0,0,0,1,0
22522,CHILDS GARDEN FORK BLUE ,0,1,0,0,0,1,0
22523,CHILDS GARDEN FORK PINK,0,1,0,0,0,1,0
22524,CHILDRENS GARDEN GLOVES BLUE,0,1,0,0,0,1,0
22525,CHILDRENS GARDEN GLOVES PINK,0,1,0,0,0,1,0
22526,WHEELBARROW FOR CHILDREN ,0,0,0,0,0,0,1
22528,GARDENERS KNEELING PAD,0,0,0,0,0,1,0
22529,MAGIC DRAWING SLATE GO TO THE FAIR ,0,0,0,0,0,0,1
22530,MAGIC DRAWING SLATE DOLLY GIRL ,0,0,0,0,0,0,1
22531,MAGIC DRAWING SLATE CIRCUS PARADE  ,0,0,0,0,0,0,1
22532,MAGIC DRAWING SLATE LEAP FROG ,0,0,0,0,0,0,1
22533,MAGIC DRAWING SLATE BAKE A CAKE ,0,0,0,0,0,0,1
22534,MAGIC DRAWING SLATE SPACEBOY ,0,0,0,0,0,0,1
22535,MAGIC DRAWING SLATE BUNNIES ,0,0,0,1,0,0,0
22536,MAGIC DRAWING SLATE PURDEY,0,0,0,0,0,0,1
22537,MAGIC DRAWING SLATE DINOSAUR,0,0,0,0,0,0,1
22538,MINI JIGSAW GO TO THE FAIR,0,0,0,0,0,0,1
22539,MINI JIGSAW DOLLY GIRL,0,0,0,0,0,0,1
22540,MINI JIGSAW CIRCUS PARADE ,0,0,0,0,0,0,1
22541,MINI JIGSAW LEAP FROG,0,0,0,0,0,0,1
22543,MINI JIGSAW BAKE A CAKE ,0,0,0,0,0,0,1
22544,MINI JIGSAW SPACEBOY,0,0,0,0,0,0,1
22545,MINI JIGSAW BUNNIES,0,0,0,1,0,0,0
22546,MINI JIGSAW PURDEY,0,0,0,0,0,0,1
22547,MINI JIGSAW DINOSAUR ,0,0,0,0,0,0,1
22548,HEADS AND TAILS SPORTING FUN,0,0,0,0,0,0,1
22549,PICTURE DOMINOES,0,0,0,0,0,0,1
22550,HOLIDAY FUN LUDO,0,0,0,1,0,0,0
22551,PLASTERS IN TIN SPACEBOY,0,0,0,0,0,0,1
22553,PLASTERS IN TIN SKULLS,0,0,0,1,0,0,0
22554,PLASTERS IN TIN WOODLAND ANIMALS,0,0,1,1,0,0,0
22555,PLASTERS IN TIN STRONGMAN,0,0,0,0,0,0,1
22556,PLASTERS IN TIN CIRCUS PARADE ,0,0,0,0,0,0,1
22557,PLASTERS IN TIN VINTAGE PAISLEY ,0,0,0,1,0,0,0
22558,CLOTHES PEGS RETROSPOT PACK 24 ,1,0,0,1,0,1,0
22559,SEASIDE FLYING DISC,0,0,0,0,0,0,1
22560,TRADITIONAL MODELLING CLAY,0,0,0,1,0,0,0
22561,WOODEN SCHOOL COLOURING SET,1,0,1,0,1,0,0
22562,MONSTERS STENCIL CRAFT,0,0,0,0,0,0,1
22563,HAPPY STENCIL CRAFT,0,0,0,0,0,0,1
22564,ALPHABET STENCIL CRAFT,0,0,0,0,0,0,1
22565,FELTCRAFT HAIRBANDS PINK AND WHITE ,0,1,1,0,0,0,0
22566,FELTCRAFT HAIRBAND PINK AND PURPLE,0,1,1,0,0,0,0
22567,20 DOLLY PEGS RETROSPOT,0,0,0,1,0,1,0
22568,FELTCRAFT CUSHION OWL,0,0,1,0,0,1,0
22569,FELTCRAFT CUSHION BUTTERFLY,0,0,1,1,0,1,0
22570,FELTCRAFT CUSHION RABBIT,0,0,1,0,0,1,0
22571,ROCKING HORSE RED CHRISTMAS ,0,1,0,1,0,0,0
22572,ROCKING HORSE GREEN CHRISTMAS ,0,1,0,1,0,0,0
22573,STAR WOODEN CHRISTMAS DECORATION,0,0,1,1,0,0,0
22574,HEART WOODEN CHRISTMAS DECORATION,0,0,1,1,0,0,0
22575,METAL MERRY CHRISTMAS WREATH,0,0,1,1,0,0,0
22576,SWALLOW WOODEN CHRISTMAS DECORATION,0,0,1,1,0,0,0
22577,WOODEN HEART CHRISTMAS SCANDINAVIAN,0,0,1,1,0,0,0
22578,WOODEN STAR CHRISTMAS SCANDINAVIAN,0,0,1,1,0,0,0
22579,WOODEN TREE CHRISTMAS SCANDINAVIAN,0,0,1,1,0,0,0
22580,ADVENT CALENDAR GINGHAM SACK,0,0,0,0,0,0,1
22581,WOOD STOCKING CHRISTMAS SCANDISPOT,0,0,1,1,0,1,0
22582,PACK OF 6 SWEETIE GIFT BOXES,1,0,0,0,0,1,0
22583,PACK OF 6 HANDBAG GIFT BOXES,1,0,0,0,0,1,0
22584,PACK OF 6 PANETTONE GIFT BOXES,1,0,0,0,0,1,0
22584,PACK OF 6 PANNETONE GIFT BOXES,1,0,0,0,0,1,0
22585,PACK OF 6 BIRDY GIFT TAGS,1,0,0,1,0,1,0
22586,FELTCRAFT HAIRBAND PINK AND BLUE,0,1,1,0,0,0,0
22587,FELTCRAFT HAIRBAND RED AND BLUE,0,1,1,0,0,0,0
22588,CARD HOLDER GINGHAM HEART,0,0,0,1,0,0,0
22589,CARDHOLDER GINGHAM STAR,0,0,0,1,0,0,0
22591,CARDHOLDER GINGHAM CHRISTMAS TREE,0,0,0,1,0,0,0
22592,CARDHOLDER HOLLY WREATH METAL,0,0,1,0,0,0,0
22593,CHRISTMAS GINGHAM STAR,0,0,0,1,0,0,0
22594,CHRISTMAS GINGHAM TREE,0,0,0,1,0,0,0
22595,CHRISTMAS GINGHAM HEART,0,0,0,1,0,0,0
22595,GINGHAM HEART DECORATION,0,0,0,1,0,0,0
22596,CHRISTMAS STAR WISH LIST CHALKBOARD,0,0,0,1,0,0,0
22597,CHRISTMAS MUSICAL ZINC HEART ,0,0,0,1,0,0,0
22597,MUSICAL ZINC HEART DECORATION ,0,0,0,1,0,0,0
22598,CHRISTMAS MUSICAL ZINC TREE,0,0,0,1,0,0,0
22599,CHRISTMAS MUSICAL ZINC STAR,0,0,0,1,0,0,0
22600,CHRISTMAS RETROSPOT STAR WOOD,0,0,1,1,0,1,0
22601,CHRISTMAS RETROSPOT ANGEL WOOD,0,0,1,1,0,1,0
22602,CHRISTMAS RETROSPOT HEART WOOD,0,0,1,1,0,1,0
22602,RETROSPOT WOODEN HEART DECORATION,0,0,1,1,0,1,0
22603,CHRISTMAS RETROSPOT TREE WOOD,0,0,1,1,0,1,0
22604,SET OF 4 NAPKIN CHARMS CUTLERY,1,0,0,0,0,1,0
22605,WOODEN CROQUET GARDEN SET,1,0,1,0,0,1,0
22606,WOODEN SKITTLES GARDEN SET,1,0,1,0,0,1,0
22607,WOODEN ROUNDERS GARDEN SET ,1,0,1,0,0,1,0
22608,PENS ASSORTED FUNKY JEWELED ,1,0,0,0,0,0,0
22609,PENS ASSORTED SPACEBALL,1,0,0,0,0,0,0
22610,PENS ASSORTED FUNNY FACE,1,0,0,0,0,0,0
22611,VINTAGE UNION JACK SHOPPING BAG,0,0,0,1,0,0,0
22613,PACK OF 20 SPACEBOY NAPKINS,1,0,0,0,0,0,0
22614,PACK OF 12 SPACEBOY TISSUES,1,0,0,0,0,0,0
22615,PACK OF 12 CIRCUS PARADE TISSUES ,1,0,0,0,0,0,0
22616,PACK OF 12 LONDON TISSUES ,1,0,0,0,0,0,0
22617,BAKING SET SPACEBOY DESIGN,1,0,0,1,0,0,0
22618,COOKING SET RETROSPOT,1,0,0,1,0,1,0
22619,SET OF 6 SOLDIER SKITTLES,1,0,0,0,0,0,0
22620,4 TRADITIONAL SPINNING TOPS,0,0,0,1,0,0,0
22621,TRADITIONAL KNITTING NANCY,0,0,0,1,0,0,0
22622,BOX OF VINTAGE ALPHABET BLOCKS,1,0,0,1,0,0,0
22623,BOX OF VINTAGE JIGSAW BLOCKS ,1,0,0,1,0,0,0
22624,IVORY KITCHEN SCALES,0,0,0,0,0,1,0
22625,RED KITCHEN SCALES,0,1,0,0,0,1,0
22626,BLACK KITCHEN SCALES,0,1,0,0,0,1,0
22627,MINT KITCHEN SCALES,0,0,0,0,0,1,0
22628,PICNIC BOXES SET OF 3 RETROSPOT ,1,0,0,1,0,1,0
22629,SPACEBOY LUNCH BOX ,1,0,0,0,0,0,0
22630,DOLLY GIRL LUNCH BOX,1,0,0,0,0,0,0
22631,CIRCUS PARADE LUNCH BOX ,1,0,0,0,0,0,0
22632,HAND WARMER RED POLKA DOT,0,1,0,0,0,0,0
22632,HAND WARMER RED RETROSPOT,0,1,0,1,0,1,0
22633,HAND WARMER UNION JACK,0,0,0,0,0,0,1
22634,CHILDS BREAKFAST SET SPACEBOY ,1,0,0,0,0,0,0
22635,CHILDS BREAKFAST SET DOLLY GIRL ,1,0,0,0,0,0,0
22636,CHILDS BREAKFAST SET CIRCUS PARADE,1,0,0,0,0,0,0
22637,PIGGY BANK RETROSPOT ,0,0,0,1,0,1,0
22638,SET OF 4 NAPKIN CHARMS CROWNS ,1,0,0,0,0,0,0
22639,SET OF 4 NAPKIN CHARMS HEARTS,1,0,0,1,0,0,0
22640,SET OF 4 NAPKIN CHARMS 3 KEYS ,1,0,0,0,0,0,0
22641,SET OF 4 NAPKIN CHARMS INSTRUMENT,1,0,0,0,0,0,0
22642,SET OF 4 NAPKIN CHARMS STARS   ,1,0,0,1,0,0,0
22643,SET OF 4 NAPKIN CHARMS LEAVES   ,1,0,0,0,0,0,0
22644,CERAMIC CHERRY CAKE MONEY BANK,0,0,0,1,0,0,0
22645,CERAMIC HEART FAIRY CAKE MONEY BANK,0,0,0,1,0,0,0
22646,CERAMIC STRAWBERRY CAKE MONEY BANK,0,0,0,1,0,0,0
22647,CERAMIC LOVE HEART MONEY BANK,0,0,0,1,0,0,0
22649,STRAWBERRY FAIRY CAKE TEAPOT,0,0,0,1,0,1,0
22650,CERAMIC PIRATE CHEST MONEY BANK,0,0,0,0,0,0,1
22651,GENTLEMAN SHIRT REPAIR KIT ,0,0,0,0,0,0,1
22652,TRAVEL SEWING KIT,0,0,0,0,0,0,1
22653,BUTTON BOX ,1,0,0,0,0,0,0
22654,DELUXE SEWING KIT ,0,0,0,0,0,0,1
22655,VINTAGE RED KITCHEN CABINET,0,1,0,1,0,1,0
22656,VINTAGE BLUE KITCHEN CABINET,0,1,0,1,0,1,0
22659,LUNCH BOX I LOVE LONDON,1,0,0,0,0,0,0
22660,DOORMAT I LOVE LONDON,0,0,0,0,0,1,0
22661,CHARLOTTE BAG DOLLY GIRL DESIGN,0,0,0,1,0,0,0
22662,LUNCH BAG DOLLY GIRL DESIGN,0,0,0,1,0,0,0
22663,JUMBO BAG DOLLY GIRL DESIGN,0,0,0,1,0,0,0
22664,TOY TIDY DOLLY GIRL DESIGN,0,0,0,1,0,0,0
22665,RECIPE BOX BLUE SKETCHBOOK DESIGN,1,1,0,1,0,0,0
22666,RECIPE BOX PANTRY YELLOW DESIGN,1,1,0,1,0,1,0
22667,RECIPE BOX RETROSPOT ,1,0,0,1,0,1,0
22668,PINK BABY BUNTING,0,1,0,0,0,0,0
22669,RED BABY BUNTING ,0,1,0,0,0,0,0
22670,FRENCH WC SIGN BLUE METAL,0,1,1,1,0,0,0
22671,FRENCH LAUNDRY SIGN BLUE METAL,0,1,1,1,0,0,0
22672,FRENCH BATHROOM SIGN BLUE METAL,0,1,1,1,0,1,0
22673,FRENCH GARDEN SIGN BLUE METAL,0,1,1,1,0,1,0
22674,FRENCH TOILET SIGN BLUE METAL,0,1,1,1,0,0,0
22675,FRENCH KITCHEN SIGN BLUE METAL,0,1,1,1,0,1,0
22676,FRENCH BLUE METAL DOOR SIGN 1,0,1,1,1,0,0,0
22677,FRENCH BLUE METAL DOOR SIGN 2,0,1,1,1,0,0,0
22678,FRENCH BLUE METAL DOOR SIGN 3,0,1,1,1,0,0,0
22679,FRENCH BLUE METAL DOOR SIGN 4,0,1,1,1,0,0,0
22680,FRENCH BLUE METAL DOOR SIGN 5,0,1,1,1,0,0,0
22681,FRENCH BLUE METAL DOOR SIGN 6,0,1,1,1,0,0,0
22682,FRENCH BLUE METAL DOOR SIGN 7,0,1,1,1,0,0,0
22683,FRENCH BLUE METAL DOOR SIGN 8,0,1,1,1,0,0,0
22684,FRENCH BLUE METAL DOOR SIGN 9,0,1,1,1,0,0,0
22685,FRENCH BLUE METAL DOOR SIGN 0,0,1,1,1,0,0,0
22687,DOORMAT CHRISTMAS VILLAGE,0,0,0,1,0,1,0
22688,DOORMAT PEACE ON EARTH BLUE,0,1,0,0,0,1,0
22689,DOORMAT MERRY CHRISTMAS RED ,0,1,0,1,0,1,0
22690,DOORMAT HOME SWEET HOME BLUE ,0,1,0,0,0,1,0
22691,DOORMAT WELCOME SUNRISE,0,0,0,0,0,1,0
22692,DOORMAT WELCOME TO OUR HOME,0,0,0,0,0,1,0
22693,GROW A FLYTRAP OR SUNFLOWER IN TIN,0,0,0,1,0,0,0
22694,WICKER STAR ,0,0,0,1,0,0,0
22695,WICKER WREATH SMALL,0,0,0,0,0,0,1
22696,WICKER WREATH LARGE,0,0,0,0,0,0,1
22697,GREEN REGENCY TEACUP AND SAUCER,0,1,0,0,0,1,0
22698,PINK REGENCY TEACUP AND SAUCER,0,1,0,0,0,1,0
22699,ROSES REGENCY TEACUP AND SAUCER ,0,0,0,0,0,1,0
22700,BLACK AND WHITE DOG BOWL,0,1,0,1,0,0,0
22701,PINK DOG BOWL,0,1,0,1,0,0,0
22702,BLACK AND WHITE CAT BOWL,0,1,0,1,0,0,0
22703,PINK CAT BOWL,0,1,0,1,0,0,0
22704,WRAP RED APPLES ,0,1,0,1,0,0,0
22705,WRAP GREEN PEARS ,0,1,0,0,0,0,0
22706,WRAP COWBOYS  ,0,0,0,1,0,0,0
22707,WRAP MONSTER FUN ,0,0,0,0,0,0,1
22708,WRAP DOLLY GIRL,0,0,0,0,0,0,1
22709,WRAP WEDDING DAY,0,0,0,0,0,0,1
22710,WRAP I LOVE LONDON ,0,0,0,0,0,0,1
22711,WRAP CIRCUS PARADE,0,0,0,0,0,0,1
22712,CARD DOLLY GIRL ,0,0,0,0,0,0,1
22713,CARD I LOVE LONDON ,0,0,0,0,0,0,1
22714,CARD BIRTHDAY COWBOY,0,0,0,1,0,0,0
22715,CARD WEDDING DAY,0,0,0,0,0,0,1
22716,CARD CIRCUS PARADE,0,0,0,0,0,0,1
22717,CARD DOG AND BALL ,0,0,0,1,0,0,0
22718,CARD CAT AND TREE ,0,0,0,1,0,0,0
22719,GUMBALL MONOCHROME COAT RACK,0,0,0,0,0,0,1
22720,SET OF 3 CAKE TINS PANTRY DESIGN ,1,0,0,1,0,1,0
22721,SET OF 3 CAKE TINS SKETCHBOOK,1,0,0,0,0,0,0
22722,SET OF 6 SPICE TINS PANTRY DESIGN,1,0,0,1,0,1,0
22723,SET OF 6 HERB TINS SKETCHBOOK,1,0,0,0,0,1,0
22725,ALARM CLOCK BAKELIKE CHOCOLATE,0,0,0,0,0,1,0
22726,ALARM CLOCK BAKELIKE GREEN,0,1,0,0,0,1,0
22727,ALARM CLOCK BAKELIKE RED ,0,1,0,0,0,1,0
22728,ALARM CLOCK BAKELIKE PINK,0,1,0,0,0,1,0
22729,ALARM CLOCK BAKELIKE ORANGE,0,1,0,0,0,1,0
22730,ALARM CLOCK BAKELIKE IVORY,0,0,0,0,0,1,0
22731,3D CHRISTMAS STAMPS STICKERS ,0,0,0,1,0,0,0
22732,3D VINTAGE CHRISTMAS STICKERS ,0,0,0,1,0,0,0
22733,3D TRADITIONAL CHRISTMAS STICKERS,0,0,0,1,0,0,0
22734,SET OF 6 RIBBONS VINTAGE CHRISTMAS,1,0,0,1,0,0,0
22735,RIBBON REEL SOCKS AND MITTENS,0,0,0,0,0,0,1
22736,RIBBON REEL MAKING SNOWMEN ,0,0,0,0,0,0,1
22737,RIBBON REEL CHRISTMAS PRESENT ,0,0,0,1,0,0,0
22738,RIBBON REEL SNOWY VILLAGE,0,0,0,0,0,0,1
22739,RIBBON REEL CHRISTMAS SOCK BAUBLE,0,0,0,1,0,0,0
22740,POLKADOT PEN,0,0,0,1,0,0,0
22741,FUNKY DIVA PEN,0,0,0,0,0,0,1
22742,MAKE YOUR OWN PLAYTIME CARD KIT,0,0,0,0,0,0,1
22743,MAKE YOUR OWN FLOWERPOWER CARD KIT,0,0,0,1,0,0,0
22744,MAKE YOUR OWN MONSOON CARD KIT,0,0,0,0,0,0,1
