StockCode,Description,SETS,Colors,Material,Design,Jewelry,Household,MISC
23223,CHRISTMAS TREE HANGING SILVER ,0,0,0,1,0,0,0
23224,CHERUB HEART DECORATION GOLD,0,0,0,1,0,0,0
23225,CHERUB HEART DECORATION SILVER ,0,0,0,1,0,0,0
23226,FILIGREE HEART DAISY WHITE,0,1,0,1,0,0,0
23227,FILIGREE HEART BUTTERFLY WHITE ,0,1,0,1,0,0,0
23228,FILIGREE HEART BIRD WHITE ,0,1,0,1,0,0,0
23229,DONKEY TAIL GAME ,0,0,0,0,0,0,1
23229,VINTAGE DONKEY TAIL GAME ,0,0,0,1,0,0,0
23230,WRAP ALPHABET DESIGN,0,0,0,1,0,0,0
23231,WRAP  VINTAGE DOILEY ,0,0,0,1,0,0,0
23231,WRAP  VINTAGE DOILY ,0,0,0,1,0,0,0
23231,WRAP DOILEY DESIGN,0,0,0,1,0,0,0
23232,WRAP VINTAGE LEAF DESIGN,0,0,0,1,0,0,0
23232,WRAP VINTAGE PETALS  DESIGN,0,0,0,1,0,0,0
23233,WRAP POPPIES  DESIGN,0,0,0,1,0,0,0
23234,BISCUIT TIN VINTAGE CHRISTMAS,0,0,0,1,0,0,0
23235,BISCUIT TIN VINTAGE LEAF,0,0,0,1,0,0,0
23235,STORAGE TIN VINTAGE LEAF,0,0,0,1,0,0,0
23236,DOILEY BISCUIT TIN,0,0,0,0,0,0,1
23236,DOILEY STORAGE TIN,0,0,0,0,0,0,1
23236,STORAGE TIN VINTAGE DOILEY ,0,0,0,1,0,0,0
23236,STORAGE TIN VINTAGE DOILY ,0,0,0,1,0,0,0
23237,SET OF 4 KNICK KNACK TINS LEAF,1,0,0,0,0,0,0
23237,SET OF 4 KNICK KNACK TINS LEAVES ,1,0,0,0,0,0,0
23238,SET OF 4 KNICK KNACK TINS LONDON ,1,0,0,0,0,0,0
23239,SET OF 4 KNICK KNACK TINS POPPIES,1,0,0,0,0,0,0
23240,SET OF 4 KNICK KNACK TINS  DOILEY ,1,0,0,0,0,0,0
23240,SET OF 4 KNICK KNACK TINS DOILEY ,1,0,0,0,0,0,0
23240,SET OF 4 KNICK KNACK TINS DOILY ,1,0,0,0,0,0,0
23241,TREASURE TIN GYMKHANA DESIGN,0,0,0,1,0,0,0
23242,TREASURE TIN BUFFALO BILL ,0,0,0,0,0,0,1
23243,SET OF TEA COFFEE SUGAR TINS PANTRY,1,0,0,0,0,1,0
23244,CANNISTER VINTAGE LEAF DESIGN,0,0,0,1,0,0,0
23244,ROUND STORAGE TIN VINTAGE LEAF,0,0,0,1,0,0,0
23245,SET OF 3 REGENCY CAKE TINS,1,0,0,0,0,0,0
23247,BISCUIT TIN 50'S CHRISTMAS,0,0,0,1,0,0,0
23249,ENAMEL DINNER PLATE PANTRY,0,0,0,0,0,1,0
23249,VINTAGE RED ENAMEL TRIM PLATE,0,1,0,1,0,1,0
23250,ENAMEL BOWL PANTRY,0,0,0,0,0,1,0
23250,VINTAGE RED TRIM ENAMEL BOWL ,0,1,0,1,0,0,0
23251,ENAMEL MUG PANTRY,0,0,0,0,0,1,0
23251,VINTAGE RED ENAMEL TRIM MUG ,0,1,0,1,0,1,0
23252,ENAMEL JUG PANTRY,0,0,0,0,0,1,0
23252,VINTAGE RED ENAMEL TRIM JUG ,0,1,0,1,0,1,0
23253,16 PC CUTLERY SET PANTRY DESIGN,1,0,0,1,0,1,0
23253,16 PIECE CUTLERY SET PANTRY DESIGN,1,0,0,1,0,1,0
23254,CHILDRENS CUTLERY DOLLY GIRL ,0,0,0,0,0,1,0
23254,KIDS CUTLERY DOLLY GIRL ,0,0,0,0,0,1,0
23255,CHILDRENS CUTLERY CIRCUS PARADE,0,0,0,0,0,1,0
23256,CHILDRENS CUTLERY SPACEBOY ,0,0,0,0,0,1,0
23256,KIDS CUTLERY SPACEBOY ,0,0,0,0,0,1,0
23263,SET OF 3 WOODEN HEART DECORATIONS,1,0,1,1,0,0,0
23264,SET OF 3 WOODEN SLEIGH DECORATIONS,1,0,1,0,0,0,0
23265,SET OF 3 WOODEN TREE DECORATIONS,1,0,1,1,0,0,0
23266,SET OF 3 WOODEN STOCKING DECORATION,1,0,1,0,0,0,0
23267,SET OF 4 SANTA PLACE SETTINGS,1,0,0,0,0,0,0
23268,SET OF 2 CERAMIC CHRISTMAS REINDEER,1,0,0,1,0,0,0
23269,SET OF 2 CERAMIC CHRISTMAS TREES,1,0,0,1,0,0,0
23270,SET OF 2 CERAMIC PAINTED HEARTS ,1,0,0,1,0,0,0
23271,CHRISTMAS TABLE CANDLE SILVER SPIKE,0,0,0,1,0,1,0
23271,CHRISTMAS TABLE SILVER CANDLE SPIKE,0,0,0,1,0,1,0
23272,TREE T-LIGHT HOLDER WILLIE WINKIE,0,0,0,1,0,0,0
23273,HEART T-LIGHT HOLDER WILLIE WINKIE,0,0,0,1,0,0,0
23274,STAR T-LIGHT HOLDER WILLIE WINKIE,0,0,0,1,0,0,0
23275,SET OF 3 HANGING OWLS OLLIE BEAK,1,0,0,0,0,0,0
23280,FOLDING BUTTERFLY MIRROR HOT PINK ,0,1,0,1,0,0,0
23280,FOLDING MIRROR HOT PINK ,0,1,0,0,0,0,0
23281,FOLDING BUTTERFLY MIRROR RED  ,0,1,0,1,0,0,0
23281,FOLDING MIRROR RED  ,0,1,0,0,0,0,0
23282,FOLDING BUTTERFLY MIRROR IVORY ,0,0,0,1,0,0,0
23282,FOLDING MIRROR IVORY ,0,0,0,0,0,0,1
23283,DOORMAT VINTAGE LEAF,0,0,0,1,0,1,0
23283,DOORMAT VINTAGE LEAVES DESIGN ,0,0,0,1,0,1,0
23284,DOORMAT KEEP CALM AND COME IN,0,0,0,0,0,1,0
23285,PINK VINTAGE SPOT BEAKER,0,1,0,1,0,1,0
23286,BLUE VINTAGE SPOT BEAKER,0,1,0,1,0,1,0
23287,RED VINTAGE SPOT BEAKER,0,1,0,1,0,1,0
23288,GREEN VINTAGE SPOT BEAKER,0,1,0,1,0,1,0
23289,DOLLY GIRL CHILDRENS BOWL,0,0,0,0,0,0,1
23290,SPACEBOY CHILDRENS BOWL,0,0,0,0,0,0,1
23291,DOLLY GIRL CHILDRENS CUP,0,0,0,0,0,1,0
23292,SPACE BOY CHILDRENS CUP,0,0,0,0,0,1,0
23292,SPACEBOY CHILDRENS CUP,0,0,0,0,0,1,0
23293,SET OF 12 FAIRY CAKE BAKING CASES,1,0,0,1,0,0,0
23294,SET OF 6 SNACK LOAF BAKING CASES,1,0,0,0,0,0,0
23295,SET OF 12 MINI LOAF BAKING CASES,1,0,0,0,0,0,0
23296,SET OF 6 TEA TIME BAKING CASES,1,0,0,0,0,0,0
23297,SET 40 HEART SHAPE PETIT FOUR CASES,1,0,0,1,0,0,0
23298,"BUNTING , SPOTTY ",0,0,0,0,0,1,0
23298,SPOTTY BUNTING,0,0,0,0,0,1,0
23299,"FOOD COVER WITH BEADS , SET 2 SIZES",1,0,0,0,0,0,0
23299,FOOD COVER WITH BEADS SET 2 ,1,0,0,0,0,0,0
23300,GARDENERS KNEELING PAD CUP OF TEA ,0,0,0,0,0,1,0
23301,GARDENERS KNEELING PAD KEEP CALM ,0,0,0,0,0,1,0
23302,KNEELING MAT HOUSEWORK  DESIGN,0,0,0,1,0,0,0
23303,SET 4 PICNIC CUTLERY FONDANT,1,0,0,0,0,1,0
23304,SET 4 PICNIC CUTLERY CHERRY ,1,0,0,1,0,1,0
23305,SET 4 PICNIC CUTLERY BLUEBERRY,1,1,0,0,0,1,0
23306,SET OF 36 DOILIES PANTRY DESIGN,1,0,0,1,0,1,0
23306,SET OF 36 PANTRY PAPER DOILIES,1,0,1,0,0,1,0
23307,SET OF 60 PANTRY DESIGN CAKE CASES ,1,0,0,1,0,1,0
23308,SET OF 60 VINTAGE LEAF CAKE CASES ,1,0,0,1,0,0,0
23309,SET OF 60 I LOVE LONDON CAKE CASES ,1,0,0,0,0,0,0
23310,BUBBLEGUM RING ASSORTED,1,0,0,0,1,0,0
23311,VINTAGE CHRISTMAS STOCKING ,0,0,0,1,0,0,0
23312,VINTAGE CHRISTMAS GIFT SACK,0,0,0,1,0,1,0
23313,VINTAGE CHRISTMAS BUNTING,0,0,0,1,0,0,0
23314,VINTAGE CHRISTMAS TABLECLOTH,0,0,0,1,0,1,0
23315,IVORY REFECTORY CLOCK,0,0,0,0,0,1,0
23316,RED REFECTORY CLOCK ,0,1,0,0,0,1,0
23317,BLUE REFECTORY CLOCK ,0,1,0,0,0,1,0
23318,BOX OF 6 MINI VINTAGE CRACKERS,1,0,0,1,0,0,0
23319,BOX OF 6 MINI 50'S CRACKERS,1,0,0,0,0,0,0
23320,GIANT 50'S CHRISTMAS CRACKER,0,0,0,1,0,0,0
23321,SMALL WHITE HEART OF WICKER,0,1,0,1,0,0,0
23322,LARGE WHITE HEART OF WICKER,0,1,0,1,0,0,0
23323,WHITE WICKER STAR ,0,1,0,1,0,0,0
23324,RUSTIC STRAWBERRY JAM POT LARGE ,0,0,0,1,0,1,0
23324,RUSTIC STRAWBERRY JAMPOT LARGE ,0,0,0,1,0,1,0
23325,RUSTIC STRAWBERRY JAM POT SMALL,0,0,0,1,0,1,0
23325,RUSTIC STRAWBERRY JAMPOT SMALL,0,0,0,1,0,1,0
23326,HANGING MINI COLOURED BOTTLES,0,1,0,0,0,1,0
23327,HANGING CLEAR MINI BOTTLE,0,0,0,0,0,1,0
23328,SET 6 SCHOOL MILK BOTTLES IN CRATE,1,0,0,0,0,1,0
23329,DECORATIVE WICKER HEART LARGE,0,0,0,1,0,0,0
23330,DECORATIVE WICKER HEART MEDIUM,0,0,0,1,0,0,0
23331,DECORATIVE WICKER HEART SMALL,0,0,0,1,0,0,0
23332,IVORY WICKER HEART LARGE,0,0,0,1,0,0,0
23333,IVORY WICKER HEART MEDIUM,0,0,0,1,0,0,0
23334,IVORY WICKER HEART SMALL,0,0,0,1,0,0,0
23335,EGG FRYING PAN IVORY ,0,0,0,0,0,0,1
23336,EGG FRYING PAN PINK ,0,1,0,0,0,0,0
23337,EGG FRYING PAN MINT ,0,0,0,0,0,0,1
23338,EGG FRYING PAN RED ,0,1,0,0,0,0,0
23339,EGG FRYING PAN BLUE ,0,1,0,0,0,0,0
23340,VINTAGE CHRISTMAS CAKE FRILL,0,0,0,1,0,0,0
23341,PINK DINER WALL CLOCK,0,1,0,0,0,1,0
23342,MINT DINER CLOCK,0,0,0,0,0,1,0
23342,MINT DINER WALL CLOCK,0,0,0,0,0,1,0
23343,JUMBO BAG VINTAGE CHRISTMAS ,0,0,0,1,0,0,0
23344,JUMBO BAG 50'S CHRISTMAS ,0,0,0,1,0,0,0
23345, DOLLY GIRL BEAKER,0,0,0,0,0,0,1
23346,SPACEBOY BEAKER,0,0,0,0,0,0,1
23347,I LOVE LONDON BEAKER,0,0,0,0,0,0,1
23348,CHILDRENS TOY COOKING UTENSIL SET,1,0,0,0,0,0,0
23349,ROLL WRAP VINTAGE CHRISTMAS,0,0,0,1,0,0,0
23350,ROLL WRAP VINTAGE SPOT ,0,0,0,1,0,1,0
23351,ROLL WRAP 50'S CHRISTMAS,0,0,0,1,0,0,0
23352,ROLL WRAP 50'S RED CHRISTMAS ,0,1,0,1,0,0,0
23353,6 GIFT TAGS VINTAGE CHRISTMAS ,0,0,0,1,0,1,0
23354,6 GIFT TAGS 50'S CHRISTMAS ,0,0,0,1,0,1,0
23355,HOT WATER BOTTLE KEEP CALM,0,0,0,0,0,1,0
23356,LOVE HOT WATER BOTTLE,0,0,0,0,0,1,0
23357,HOT WATER BOTTLE SEX BOMB,0,0,0,0,0,1,0
23358,HOT STUFF HOT WATER BOTTLE,0,0,0,0,0,1,0
23359,SET OF 12 T-LIGHTS VINTAGE DOILEY,1,0,0,1,0,0,0
23359,SET OF 12 T-LIGHTS VINTAGE DOILY,1,0,0,1,0,0,0
23360,SET 8 CANDLES VINTAGE DOILEY,1,0,0,1,0,1,0
23360,SET 8 CANDLES VINTAGE DOILY,1,0,0,1,0,1,0
23365,SET 12 COLOUR PENCILS LOVE LONDON,1,0,0,0,0,0,0
23366,SET 12 COLOUR PENCILS DOILEY,1,0,0,0,0,0,0
23366,SET 12 COLOURING PENCILS DOILEY,1,0,0,0,1,0,0
23366,SET 12 COLOURING PENCILS DOILY,1,0,0,0,1,0,0
23367,SET 12 COLOUR PENCILS SPACEBOY ,1,0,0,0,0,0,0
23368,SET 12 COLOUR PENCILS DOLLY GIRL ,1,0,0,0,0,0,0
23369,SET 36 COLOUR PENCILS LOVE LONDON,1,0,0,0,0,0,0
23370,SET 36 COLOUR PENCILS DOILEY,1,0,0,0,0,0,0
23370,SET 36 COLOURING PENCILS DOILEY,1,0,0,0,1,0,0
23370,SET 36 COLOURING PENCILS DOILY,1,0,0,0,1,0,0
23371,SET 36 COLOUR PENCILS SPACEBOY ,1,0,0,0,0,0,0
23372,SET 36 COLOUR PENCILS DOLLY GIRL,1,0,0,0,0,0,0
23373,VINTAGE CHRISTMAS PAPER GIFT BAG,0,0,1,1,0,1,0
23374,RED SPOT PAPER GIFT BAG,0,1,1,0,0,1,0
23375,50'S CHRISTMAS PAPER GIFT BAG,0,0,1,1,0,1,0
23376,PACK OF 12 VINTAGE CHRISTMAS TISSUE,1,0,0,1,0,0,0
23377,PACK OF 12 DOLLY GIRL TISSUES,1,0,0,0,0,0,0
23378,PACK OF 12 50'S CHRISTMAS TISSUES,1,0,0,1,0,0,0
23379,PACK OF 12 RED APPLE TISSUES,1,1,0,1,0,0,0
23380,PACK OF 12 DOILEY TISSUES,1,0,0,0,0,0,0
23380,PACK OF 12 VINTAGE DOILY TISSUES,1,0,0,1,0,0,0
23381,PACK OF 12 VINTAGE LEAF TISSUES ,1,0,0,1,0,0,0
23382,BOX OF 6 CHRISTMAS CAKE DECORATIONS,1,0,0,1,0,0,0
23388,WOODLAND MINI BACKPACK,1,0,1,0,0,0,0
23388,WOODLAND MINI RUCKSACK ,0,0,1,0,0,0,0
23389,SPACEBOY MINI BACKPACK,1,0,0,0,0,0,0
23389,SPACEBOY MINI RUCKSACK,0,0,0,0,0,0,1
23390,DOLLY GIRL MINI BACKPACK,1,0,0,0,0,0,0
23390,DOLLY GIRL MINI RUCKSACK,0,0,0,0,0,0,1
23391, I LOVE LONDON MINI BACKPACK,1,0,0,0,0,0,0
23391, I LOVE LONDON MINI RUCKSACK,0,0,0,0,0,0,1
23392,SPACEBOY ROCKET LOLLY MAKERS,0,0,0,0,0,0,1
23393,HOME SWEET HOME CUSHION COVER ,0,0,0,0,0,1,0
23394,POSTE FRANCE CUSHION COVER,0,0,0,0,0,1,0
23395,BELLE JARDINIERE CUSHION COVER,0,0,0,0,0,1,0
23396,BUTTERFLY CUSHION COVER,0,0,0,1,0,1,0
23396,LA JARDIN BOTANIQUE CUSHION COVER,0,0,0,0,0,1,0
23396,LE JARDIN BOTANIQUE CUSHION COVER,0,0,0,0,0,1,0
23397,FOOT STOOL HOME SWEET HOME ,0,0,0,0,0,1,0
23398,HANGING HEART BONHEUR,0,0,0,1,0,0,0
23399,HOME SWEET HOME HANGING HEART,0,0,0,1,0,1,0
23400,SHELF WITH 4 HOOKS HOME SWEET HOME,0,0,0,0,0,1,0
23401,RUSTIC MIRROR WITH LACE HEART,0,0,0,1,0,0,0
23402,HOME SWEEET HOME 3 PEG HANGER ,0,0,0,0,0,1,0
23402,HOME SWEET HOME 3 PEG HANGER ,0,0,0,0,0,1,0
23403,LETTER HOLDER HOME SWEET HOME,0,0,0,0,0,1,0
23404,HOME SWEET HOME BLACKBOARD,0,1,0,0,0,1,0
23405,HOME SWEET HOME 2 DRAWER CABINET,0,0,0,0,0,1,0
23406,HOME SWEET HOME KEY HOLDER,0,0,0,0,0,1,0
23407,SET OF 2 TRAYS HOME SWEET HOME,1,0,0,0,0,1,0
23408,PHOTO FRAME LINEN AND LACE SMALL,0,0,0,0,0,0,1
23409,PHOTO FRAME LINEN AND LACE LARGE,0,0,0,0,0,0,1
23410,CURIO CABINET LINEN AND LACE ,0,0,0,0,0,1,0
23411, TRELLIS COAT RACK,0,0,0,0,0,0,1
23412,HEART MIRROR ANTIQUE WHITE,0,1,0,1,0,0,0
23413,DECORATIVE VINTAGE COFFEE  BOX,1,0,0,1,0,0,0
23413,DECROTIVEVINTAGE COFFEE GRINDER BOX,1,0,0,1,0,0,0
23413,VINTAGE COFFEE GRINDER BOX,1,0,0,1,0,0,0
23414,ZINC BOX SIGN HOME,1,0,0,0,0,1,0
23415,HOME SWEET HOME HOOK,0,0,0,0,0,1,0
23416,CHAMBRE HOOK,0,0,0,0,0,0,1
23417,BATHROOM HOOK,0,0,0,0,0,1,0
23418,LAVENDER TOILETTE BOTTLE,0,0,0,0,0,1,0
23419,HOME SWEET HOME BOTTLE ,0,0,0,0,0,1,0
23420,PANTRY HOOK TEA STRAINER ,0,0,0,0,0,1,0
23421,PANTRY HOOK SPATULA,0,0,0,0,0,1,0
23422,PANTRY HOOK BALLOON WHISK ,0,0,0,0,0,1,0
23423,PANTRY 3 HOOK ROLLING PIN HANGER,0,0,0,0,0,1,0
23424,GINGHAM RECIPE BOOK BOX,1,0,0,0,0,0,0
23425,STORAGE TIN HOME SWEET HOME,0,0,0,0,0,1,0
23426,METAL SIGN DROP YOUR PANTS,0,0,1,0,0,0,0
23427,STOOL HOME SWEET HOME ,0,0,0,0,0,1,0
23428,IVORY RETRO KITCHEN WALL CLOCK,0,0,0,0,0,1,0
23429,RED RETRO KITCHEN WALL CLOCK,0,1,0,0,0,1,0
23430,BLUE RETRO KITCHEN WALL CLOCK,0,1,0,0,0,1,0
23431,NATURAL HANGING QUILTED HEARTS ,0,0,0,1,0,1,0
23432,PRETTY HANGING QUILTED HEARTS,0,0,0,1,0,1,0
23433,HANGING QUILTED PATCHWORK APPLES,0,0,0,1,0,1,0
23434,3 RAFFIA RIBBONS 50'S CHRISTMAS ,0,0,0,1,0,0,0
23435,3 RAFFIA RIBBONS VINTAGE CHRISTMAS,0,0,0,1,0,0,0
23436,GIFT BAG LARGE VINTAGE CHRISTMAS,0,0,0,1,0,1,0
23436,VINTAGE CHRISTMAS GIFT BAG LARGE ,0,0,0,1,0,1,0
23437, 50'S CHRISTMAS GIFT BAG LARGE,0,0,0,1,0,1,0
23437,GIFT BAG LARGE 50'S CHRISTMAS,0,0,0,1,0,1,0
23438, RED SPOT GIFT BAG LARGE,0,1,0,0,0,1,0
23438,GIFT BAG LARGE SPOT ,0,0,0,0,0,1,0
23439,HAND WARMER RED LOVE HEART,0,1,0,1,0,0,0
23440,PAINT YOUR OWN EGGS IN CRATE,0,0,0,0,0,0,1
23441,HAND PAINTED HANGING EASTER EGG,0,0,0,0,0,0,1
23442,12 HANGING EGGS HAND PAINTED,0,0,0,0,0,0,1
23445,ICE CREAM BUBBLES,0,0,0,0,0,0,1
23446,BLUE BUNNY EASTER EGG BASKET,0,1,0,0,0,0,0
23447,PINK BUNNY EASTER EGG BASKET,0,1,0,0,0,0,0
23448,CREAM BUNNY EASTER EGG BASKET,0,0,0,0,0,0,1
23449,SET OF 6 EASTER RAINBOW CHICKS,1,0,0,0,0,0,0
23451,SQUARE MINI PORTRAIT FRAME,0,0,0,0,0,0,1
23452,HEART MINI PORTRAIT FRAME,0,0,0,1,0,0,0
23453,OVAL  MINI PORTRAIT FRAME,0,0,0,0,0,0,1
23454,SET OF 3 MINI HANGING PORTRAITS,1,0,0,0,0,0,0
23454,THREE MINI HANGING FRAMES,0,0,0,0,0,0,1
23455,SMALL PARLOUR FRAME,0,0,0,0,0,0,1
23455,SMALL PARLOUR PICTURE FRAME,0,0,0,0,0,0,1
23456,MEDIUM PARLOUR FRAME ,0,0,0,0,0,0,1
23456,MEDIUM PARLOUR PICTURE FRAME ,0,0,0,0,0,0,1
23457,LARGE PARLOUR FRAME,0,0,0,0,0,0,1
23457,LARGE PARLOUR PICTURE FRAME,0,0,0,0,0,0,1
23458,DOLLY CABINET 3 DRAWERS ,0,0,0,0,0,1,0
23459,DOLLY CABINET 2 DRAWERS ,0,0,0,0,0,1,0
23460,SWEETHEART WALL TIDY ,0,0,0,1,0,0,0
23461,SWEETHEART BIRD HOUSE,0,0,0,1,0,0,0
23462,ROCOCO WALL MIROR,0,0,0,0,0,0,1
23462,ROCOCO WALL MIRROR WHITE,0,1,0,0,0,0,0
23463,VINTAGE ZINC WATERING CAN,0,0,0,1,1,0,0
23464,VINTAGE ZINC WATERING CAN SMALL,0,0,0,1,1,0,0
23465,TUSCAN VILLA BIRD FEEDER,0,0,0,1,0,0,0
23465,TUSCAN VILLA FEEDING STATION,0,0,0,0,0,0,1
23466,TUSCAN VILLA DOVECOTE,0,0,0,0,0,0,1
23466,TUSCAN VILLA DOVECOTE BIRD FEEDER,0,0,0,1,0,0,0
23467,VINTAGE ZINC PLANTER  ,0,0,0,1,0,0,0
23468,TUSCAN VILLA BIRD TABLE ,0,0,0,1,0,1,0
23469,CARD HOLDER LOVE BIRD SMALL,0,0,0,1,0,0,0
23470,CARD HOLDER LOVE BIRD LARGE ,0,0,0,1,0,0,0
23471,SIX DRAWER OFFICE TIDY,0,0,0,0,0,0,1
23472, NINE DRAWER OFFICE TIDY,0,0,0,0,0,0,1
23473,WOODLAND SMALL RED FELT HEART,0,1,1,1,0,0,0
23474,WOODLAND SMALL BLUE FELT HEART,0,1,1,1,0,0,0
23475,WOODLAND SMALL PINK FELT HEART,0,1,1,1,0,0,0
23476,WOODLAND LARGE RED FELT HEART,0,1,1,1,0,0,0
23477,WOODLAND LARGE BLUE FELT HEART,0,1,1,1,0,0,0
23478,WOODLAND LARGE PINK FELT HEART,0,1,1,1,0,0,0
23479,WIRE EGG BASKET ,0,0,0,0,0,0,1
23480,MINI LIGHTS WOODLAND MUSHROOMS,0,0,1,0,0,0,0
23481,PEARLISED IVORY HEART SMALL ,0,0,0,1,0,0,0
23482,PEARLISED IVORY HEART LARGE ,0,0,0,1,0,0,0
23483,HANGING  BUTTERFLY T-LIGHT HOLDER,0,0,0,1,0,0,0
23484,HEART TRELLIS TRIPLE T-LIGHT HOLDER,0,0,0,1,0,0,0
23484,HEART TRELLISTRIPLE T-LIGHT HOLDER,0,0,0,1,0,0,0
23485,BOTANICAL GARDENS WALL CLOCK ,0,0,0,0,0,1,0
23486,ANTIQUE HEART SHELF UNIT,0,0,0,1,0,0,0
23487,SWEET HEART CAKE CARRIER,0,0,0,1,0,0,0
23489,"GARLAND, VINTAGE BELLS",0,0,0,1,0,0,0
23489,VINTAGE BELLS GARLAND,0,0,0,1,0,0,0
23490,T-LIGHT HOLDER HANGING LOVE BIRD,0,0,0,1,0,0,0
23491,VINTAGE JINGLE BELLS HEART,0,0,0,1,0,0,0
23492,VINTAGE JINGLE BELLS WREATH,0,0,0,1,0,0,0
23493,VINTAGE DOILY TRAVEL SEWING KIT,0,0,0,1,0,0,0
23494,VINTAGE DOILY DELUXE SEWING KIT ,0,0,0,1,0,0,0
23495,SET OF 3 PANTRY WOODEN SPOONS,1,0,1,0,0,1,0
23496,PANTRY KITCHEN THERMOMETER ,0,0,0,0,0,1,0
23497,CLASSIC CHROME BICYCLE BELL ,0,0,0,0,0,0,1
23497,CLASSIC CROME BICYCLE BELL ,0,0,0,0,0,0,1
23498,CLASSIC BICYCLE CLIPS ,0,0,0,0,0,0,1
23499,SET 12 VINTAGE DOILY CHALK ,1,0,0,1,0,0,0
23500,KEY RING BASEBALL BOOT ASSORTED ,1,0,0,0,1,0,0
23501,KEY RING BASEBALL BOOT UNION JACK,0,0,0,0,1,0,0
23502,PLAYING CARDS VINTAGE DOILEY ,0,0,0,1,0,0,0
23502,PLAYING CARDS VINTAGE DOILY ,0,0,0,1,0,0,0
23503,PLAYING CARDS KEEP CALM & CARRY ON,0,0,0,0,0,0,1
23504,PLAYING CARDS JUBILEE UNION JACK,0,0,0,0,0,0,1
23505,PLAYING CARDS I LOVE LONDON ,0,0,0,0,0,0,1
23506,MINI PLAYING CARDS SPACEBOY ,0,0,0,0,0,0,1
23507,MINI PLAYING CARDS BUFFALO BILL ,0,0,0,0,0,0,1
23508,MINI PLAYING CARDS DOLLY GIRL ,0,0,0,0,0,0,1
23509,MINI PLAYING CARDS FUN FAIR ,0,0,0,0,0,0,1
23510,MINI PLAYING CARDS GYMKHANA,0,0,0,0,0,0,1
23511,EMBROIDERED RIBBON REEL EMILY ,0,1,0,0,0,0,0
23512,EMBROIDERED RIBBON REEL ROSIE,0,1,0,0,0,0,0
23513,EMBROIDERED RIBBON REEL SUSIE ,0,1,0,0,0,0,0
23514,EMBROIDERED RIBBON REEL SALLY ,0,1,0,0,0,0,0
23515,EMBROIDERED RIBBON REEL DAISY ,0,1,0,1,0,0,0
23516,EMBROIDERED RIBBON REEL SOPHIE  ,0,1,0,0,0,0,0
23517,EMBROIDERED RIBBON REEL REBECCA ,0,1,0,0,0,0,0
23518,EMBROIDERED RIBBON REEL RACHEL ,0,1,0,0,0,0,0
23519,EMBROIDERED RIBBON REEL CLAIRE,0,1,0,0,0,0,0
23520,EMBROIDERED RIBBON REEL RUBY ,0,1,0,0,0,0,0
23521,CAT AND BIRD WALL ART,0,0,0,1,0,0,0
23521,WALL ART CAT AND BIRD ,0,0,0,1,0,0,0
23522,DOG AND BALL WALL ART,0,0,0,1,0,0,0
23522,WALL ART DOG AND BALL ,0,0,0,1,0,0,0
23523,TREASURE AHOY WALL ART,0,0,0,0,0,0,1
23523,WALL ART TREASURE AHOY ,0,0,0,0,0,0,1
23524,HORSE & PONY WALL ART,0,0,0,0,0,0,1
23524,WALL ART HORSE & PONY ,0,0,0,0,0,0,1
23525,BUFFALO BILL WALL ART ,0,0,0,0,0,0,1
23525,WALL ART BUFFALO BILL ,0,0,0,0,0,0,1
23526,DOG LICENCE WALL ART,0,0,0,1,0,0,0
23526,WALL ART DOG LICENCE ,0,0,0,1,0,0,0
23527,ANIMALS AND NATURE WALL ART,0,0,0,1,0,0,0
23527,WALL ART ANIMALS AND NATURE ,0,0,0,1,0,0,0
23528,SPACEBOY WALL ART,0,0,0,0,0,0,1
23528,WALL ART SPACEBOY,0,0,0,0,0,0,1
23529,DOLLY GIRL WALL ART,0,0,0,0,0,0,1
23529,WALL ART DOLLY GIRL ,0,0,0,0,0,0,1
23530,WALL ART ONLY ONE PERSON ,0,0,0,0,0,0,1
23530,"WALL ART,ONLY ONE PERSON ",0,0,0,0,0,0,1
23531,WALL ART BIG LOVE ,0,0,0,0,0,0,1
23532,WALL ART WORK REST AND PLAY  ,0,0,0,0,0,0,1
23533,WALL ART GARDEN HAVEN ,0,0,0,0,0,1,0
23534,STOP FOR TEA WALL ART,0,0,0,0,0,0,1
23534,WALL ART STOP FOR TEA ,0,0,0,0,0,0,1
23535,BICYCLE SAFTEY WALL ART,0,0,0,0,0,0,1
23535,WALL ART BICYCLE SAFETY,0,0,0,0,0,0,1
23535,WALL ART BICYCLE SAFTEY ,0,0,0,0,0,0,1
23536,VILLAGE SHOW WALL ART,0,0,0,0,0,0,1
23536,WALL ART VILLAGE SHOW ,0,0,0,0,0,0,1
23537,I LOVE LONDON WALL ART,0,0,0,0,0,0,1
23537,WALL ART I LOVE LONDON ,0,0,0,0,0,0,1
23538,WALL ART VINTAGE HEART,0,0,0,1,0,0,0
23539,"WALL ART , LOVES' SECRET ",0,0,0,0,0,0,1
23539,WALL ART LOVES' SECRET ,0,0,0,0,0,0,1
23540,"WALL ART , THE MAGIC FOREST ",0,0,0,0,0,0,1
23540,WALL ART THE MAGIC FOREST ,0,0,0,0,0,0,1
23541,"WALL ART ,PUDDINGS ",0,0,0,0,0,0,1
23541,WALL ART CLASSIC PUDDINGS ,0,0,0,0,0,0,1
23542,70'S ALPHABET WALL ART,0,0,0,0,0,0,1
23542,WALL ART 70'S ALPHABET ,0,0,0,0,0,0,1
23543,KEEP CALM WALL ART ,0,0,0,0,0,0,1
23543,WALL ART KEEP CALM ,0,0,0,0,0,0,1
23544,WALL ART MID CENTURY MODERN ,0,0,0,0,0,0,1
23545,WRAP RED DOILEY,0,1,0,0,0,0,0
23545,WRAP RED VINTAGE DOILY,0,1,0,1,0,0,0
23546,WRAP PAISLEY PARK ,0,0,0,0,0,0,1
23547,WRAP FLOWER SHOP  ,0,0,0,1,0,0,0
23548,WRAP MAGIC FOREST ,0,0,0,0,0,0,1
23549,WRAP BIRD GARDEN ,0,0,0,1,0,1,0
23550,WRAP ALPHABET POSTER  ,0,0,0,0,0,0,1
23551,PACK OF 12 PAISLEY PARK TISSUES ,1,0,0,0,0,0,0
23552,BICYCLE PUNCTURE REPAIR KIT ,0,0,0,0,0,0,1
23553,LANDMARK FRAME CAMDEN TOWN ,0,0,0,0,0,0,1
23554,LANDMARK FRAME OXFORD STREET,0,0,0,1,0,0,0
23555,LANDMARK FRAME NOTTING HILL ,0,0,0,0,0,0,1
23556,LANDMARK FRAME COVENT GARDEN ,0,0,0,0,0,1,0
23557,LANDMARK FRAME BAKER STREET ,0,0,0,1,0,0,0
23558,LANDMARK FRAME LONDON BRIDGE ,0,0,0,0,0,0,1
23559,WOODLAND BUNNIES LOLLY MAKERS,0,0,1,1,0,0,0
23560,SET OF 6 RIBBONS COUNTRY STYLE,1,0,0,0,0,0,0
23561,SET OF 6 RIBBONS PARTY,1,0,0,0,0,0,0
23562,SET OF 6 RIBBONS PERFECTLY PRETTY  ,1,0,0,0,0,0,0
23564,EGG CUP MILKMAID INGRID,0,0,0,0,0,1,0
23565,EGG CUP MILKMAID HELGA ,0,0,0,0,0,1,0
23566,EGG CUP MILKMAID HEIDI,0,0,0,0,0,1,0
23567,EGG CUP HENRIETTA HEN PINK,0,1,0,0,0,1,0
23568,EGG CUP HENRIETTA HEN CREAM ,0,0,0,0,0,1,0
23569,TRADTIONAL ALPHABET STAMP SET,1,0,0,0,0,0,0
23570,TRADITIONAL PICK UP STICKS GAME ,0,0,0,1,0,0,0
23571,TRADITIONAL NAUGHTS & CROSSES,0,0,0,1,0,0,0
23574,PACKING CHARGE,1,0,0,0,0,0,0
23575,SNACK TRAY PAISLEY PARK,0,0,0,0,0,0,1
23576,SNACK TRAY RED VINTAGE DOILY,0,1,0,1,0,0,0
23578,SNACK TRAY RED GINGHAM,0,1,0,0,0,0,0
23579,SNACK TRAY I LOVE LONDON,0,0,0,0,0,0,1
23580,SNACK TRAY HAPPY FOREST  ,0,0,0,0,0,0,1
23581,JUMBO BAG PAISLEY PARK,0,0,0,0,0,0,1
23582,VINTAGE DOILY JUMBO BAG RED ,0,1,0,1,0,0,0
23583,LUNCH BAG PAISLEY PARK  ,0,0,0,0,0,0,1
23597,PAPER BUNTING PAISLEY PARK,0,0,1,0,0,0,0
23598,PAPER BUNTING VINTAGE PARTY,0,0,1,1,0,0,0
23601,SET 10 CARDS SNOWY SNOWDROPS  17100,1,0,0,0,0,0,0
23602,SET 10 CARDS 3 WISE MEN 17107,1,0,0,0,0,0,0
23603,SET 10 CARD KRAFT REINDEER 17084,1,0,0,0,0,0,0
23604,SET 10 MINI SANTA & SNOWMAN  17087,1,0,0,0,0,0,0
23605,SET 10 CARDS 12 DAYS OF XMAS 17059,1,0,0,1,0,0,0
23607,SET 10 CARDS HATS & STOCKINGS 17081,1,0,0,0,0,0,0
23608,SET 10 CARDS RUDOLPHS NOSE 17097,1,0,0,0,0,0,0
23609,SET 10 CARDS SNOWY ROBIN 17099,1,0,0,0,0,0,0
23610,SET 10 CARDS CHRISTMAS ROBIN 17095,1,0,0,1,0,0,0
23611,SET 10 CARDS RED RIDING HOOD 17214,1,1,0,0,0,0,0
23612,SET 10 MINICARDS CUTE SNOWMAN 17071,1,0,0,0,0,0,0
23613,SET 10 XMAS CARDS & BADGES 17070,1,0,0,1,0,0,0
23614,SET 10 CARDS 12 DAYS WRAP  17058,1,0,0,0,0,0,0
23615,SET 10 CARDS PRINTED GRAPHIC 17219,1,0,0,0,0,0,0
23616,SET 10 CARDS JINGLE BELLS 17217,1,0,0,0,0,0,0
23617,SET 10 CARDS SWIRLY XMAS TREE 17104,1,0,0,1,0,0,0
23619,SET 10 CARDS POINSETTIA 17093,1,0,0,0,0,0,0
23620,SET 10 CARDS PERFECT POST 17090,1,0,0,0,0,0,0
23621,SET 10 CARDS DAVID'S MADONNA 17074,1,0,0,0,0,0,0
23623,SET 10 CARD CHRISTMAS WELCOME 17112,1,0,0,1,0,0,0
23624,SET 10 CARD PERFECT NATIVITY 17089,1,0,0,0,0,0,0
23625,SET 6 CARDS SPARKLY REINDEER 17262,1,0,0,0,0,0,0
23626,SET 10 CARDS DINKY TREE 17076,1,0,0,1,0,0,0
23627,SET 10 CARDS XMAS GRAPHIC  17218,1,0,0,1,0,0,0
23628,SET 10 CARDS TRIANGLE ICONS  17220,1,0,0,0,0,0,0
23629,SET 10 CARDS DRESSING UP 17077,1,0,0,0,0,0,0
23630,SET 10 CARDS HANGING BAUBLES 17080,1,0,0,0,0,0,0
23632,SET 10 CARDS CHEERFUL ROBIN 17065,1,0,0,0,0,0,0
23633,SET 10 CARDS WORLD CHILDREN 17067,1,0,0,0,0,0,0
23634,SET 10 CARDS XMAS CHOIR 17068,1,0,0,1,0,0,0
23635,SET 10 CARDS CHRISTMAS HOLLY  17259,1,0,0,1,0,0,0
23636,SET 10 CARDS WISHING TREE 17116,1,0,0,1,0,0,0
23637,SET 10 CARDS OUT OF ORDER 17216,1,0,0,0,0,0,0
23638,SET 10 CARDS ROBIN WATERPUMP  17096,1,0,0,0,0,0,0
23639,SET 10 CARDS MAGICAL TREE 17086,1,0,0,1,0,0,0
23640,SET 10 CARDS SCOTTIE DOG 17211,1,0,0,1,0,0,0
23643,SET 10 CARDS CHRISTMAS BAUBLE 16954,1,0,0,1,0,0,0
23644,SET 10 CARDS CHRISTMAS TREE 16955,1,0,0,1,0,0,0
23645,SET 10 CHRISTMAS CARDS HOHOHO 16956,1,0,0,1,0,0,0
23646,SET 10 CARDS JINGLE BELLS 16957,1,0,0,0,0,0,0
23649,SET 10 CARDS DECK THE HALLS 16960,1,0,0,0,0,0,0
23650,SET 10 CARDS FILIGREE BAUBLE 16961,1,0,0,0,0,0,0
23652,SET 10 CARD CHRISTMAS STAMPS 16963,1,0,0,1,0,0,0
23654,SET 10 CARD SNOWMAN 16965,1,0,0,0,0,0,0
23660,HENRIETTA HEN MUG ,0,0,0,0,0,1,0
23661,MILK MAIDS MUG ,0,0,0,0,0,1,0
23664,FLOWER SHOP DESIGN MUG,0,0,0,1,0,1,0
23681,LUNCH BAG RED VINTAGE DOILY,0,1,0,1,0,0,0
23691,KEEP CALM BIRTHDAY WRAP,0,0,0,1,0,0,0
23691,WRAP KEEP CALM BIRTHDAY,0,0,0,1,0,0,0
23692,WRAP A PRETTY THANK YOU,0,0,0,0,0,0,1
23694,PAISLEY PARK CARD,0,0,0,0,0,0,1
23695,DOILY THANK YOU CARD,0,0,0,0,0,0,1
23697,A PRETTY THANK YOU CARD,0,0,0,0,0,0,1
23843,"PAPER CRAFT , LITTLE BIRDIE",0,0,1,1,0,0,0
35001G,HAND OPEN SHAPE GOLD,0,0,0,0,0,0,1
35001W,HAND OPEN SHAPE DECO.WHITE,0,1,0,0,0,0,0
35004B,SET OF 3 BLACK FLYING DUCKS,1,1,0,0,0,0,0
35004C,SET OF 3 COLOURED  FLYING DUCKS,1,1,0,0,0,0,0
35004G,SET OF 3 GOLD FLYING DUCKS,1,0,0,0,0,0,0
35004P,SET OF 3 PINK FLYING DUCKS,1,1,0,0,0,0,0
35095A,BLUE VICTORIAN FABRIC OVAL BOX,1,1,0,0,0,0,0
35095B,RED VICTORIAN FABRIC OVAL BOX,1,1,0,0,0,0,0
35241,ENAMEL BLUE RIM BISCUIT BIN,0,1,0,0,0,0,0
35265,COLOURFUL FLOWER FRUIT BOWL,0,0,0,1,0,0,0
35271S,GOLD PRINT PAPER BAG,0,0,1,0,0,0,0
35400,WOODEN BOX ADVENT CALENDAR ,1,0,1,0,0,0,0
35443,RASTA IN BATH W SPLIFF ASHTRAY,0,0,0,0,0,1,0
35471D,SET OF 3 BIRD LIGHT PINK FEATHER ,1,1,0,1,0,0,0
35591T,TURQUOISE CHRISTMAS TREE ,0,0,0,1,0,0,0
35597A,DUSTY PINK CHRISTMAS TREE 30CM,0,1,0,1,0,0,0
35597B,BLACKCHRISTMAS TREE 30CM,0,1,0,1,0,0,0
35597D,PINK/WHITE CHRISTMAS TREE 30CM,0,1,0,1,0,0,0
35598A,DUSTY PINK CHRISTMAS TREE 60CM,0,1,0,1,0,0,0
35598B,BLACK CHRISTMAS TREE 60CM,0,1,0,1,0,0,0
35598C,WHITE CHRISTMAS TREE 60CM,0,1,0,1,0,0,0
35598D,PINK/WHITE CHRISTMAS TREE 60CM,0,1,0,1,0,0,0
35599B,BLACK CHRISTMAS TREE 120CM,0,1,0,1,0,0,0
35599D,PINK AND WHITE CHRISTMAS TREE 120CM,0,1,0,1,0,0,0
35607A,PINK FLUFFY CHRISTMAS DECORATION,0,1,0,1,0,0,0
35607B,BLACK FEATHER CHRISTMAS DECORATION,0,1,0,1,0,0,0
35609A,PINK FEATHER CHRISTMAS DECORATION,0,1,0,1,0,0,0
35610A,PINK CHRISTMAS FLOCK DROPLET ,0,1,0,1,0,0,0
35610B,BLACK CHRISTMAS FLOCK DROPLET ,0,1,0,1,0,0,0
35610C,WHITE CHRISTMAS FLOCK DROPLET ,0,1,0,1,0,0,0
35637A,IVORY STRING CURTAIN WITH POLE ,0,0,0,0,1,0,0
35637C,PINK STRING CURTAIN WITH POLE,0,1,0,0,1,0,0
35638A,PINK AND BLACK STRING CURTAIN,0,1,0,0,1,0,0
35638B,PINK/BLUE STRING CURTAIN ,0,1,0,0,1,0,0
35645,VINTAGE BEAD PINK JEWEL BOX,1,1,0,1,0,0,0
35646,VINTAGE BEAD PINK EVENING BAG,0,1,0,1,0,0,0
35647,VINTAGE BEAD PINK SHADE ,0,1,0,1,0,0,0
35648,VINTAGE BEAD PINK PURSE ,0,1,0,1,0,0,0
35649,VINTAGE BEAD COSMETIC BAG ,0,0,0,1,0,0,0
35650,VINTAGE BEAD PINK JEWEL STAND,0,1,0,1,0,0,0
35651,VINTAGE BEAD PINK SCARF ,0,1,0,1,0,0,0
35653,VINTAGE BEAD NOTEBOOK,0,0,0,1,0,0,0
35809A,ENAMEL PINK TEA CONTAINER,0,1,0,0,0,0,0
35809B,ENAMEL BLUE RIM TEA CONTAINER,0,1,0,0,0,0,0
35810A,ENAMEL PINK COFFEE CONTAINER,0,1,0,0,0,0,0
35810B,ENAMEL BLUE RIM COFFEE CONTAINER,0,1,0,0,0,0,0
35815P,"ACRYLIC JEWEL SNOWFLAKE, PINK",0,1,0,0,0,0,0
35816P,"ACRYLIC JEWEL ANGEL,PINK",0,1,0,0,0,0,0
35817P,"ACRYLIC JEWEL SNOWFLAKE,PINK",0,1,0,0,0,0,0
35817P,PINK ACRYLIC JEWEL SNOWFLAKE,0,1,0,0,0,0,0
35818B,"ACRYLIC JEWEL ICICLE, BLUE",0,1,0,0,0,0,0
35818P,"ACRYLIC JEWEL ICICLE, PINK",0,1,0,0,0,0,0
35819B,"ACRYLIC HANGING JEWEL,BLUE",0,1,0,0,0,0,0
35819P,"ACRYLIC HANGING JEWEL,PINK",0,1,0,0,0,0,0
35832,WOOLLY HAT SOCK GLOVE ADVENT STRING,0,0,1,0,1,0,0
35833G,4 GOLD FLOCK CHRISTMAS BALLS,0,0,0,1,0,0,0
35833P,4 PINK FLOCK CHRISTMAS BALLS,0,1,0,1,0,0,0
35909A,RABBIT EASTER DECORATION,0,0,0,0,0,0,1
35909B,PINK FLOWERS RABBIT EASTER,0,1,0,1,0,0,0
35910A,MULTICOLOUR EASTER RABBIT ,0,0,0,0,0,0,1
35911A,MULTICOLOUR RABBIT EGG WARMER,0,0,0,0,0,0,1
35911B,PINK/FLOWER RABBIT EGG WARMER ,0,1,0,1,0,0,0
35912B,WHITE/PINK CHICK DECORATION,0,1,0,0,0,0,0
35913B,WHITE/PINK CHICK EASTER DECORATION,0,1,0,0,0,0,0
35914,PINK CHICK EGG WARMER + EGG CUP,0,1,0,0,0,1,0
35915B,BLUE KNITTED HEN ,0,1,0,0,0,0,0
